386,1,1,1,1,1,1,1,1,0,0,0,0,0,0,0,0,1,1,1,1,1,1,1,1,0,0,0,0,0,0,0,0,0,0,0,0,0,0,0,0,False,False,False,False,False,False,False,False,0,0,3,0,0,0,0,0,"ハァ……ハァ……ハァ……助けてくれ……。
人狼族の野武士に、襲われて逃げてきたんだ。
アイツらときたら、同族だろうがお構いなしでな……。","ヤツらに追われたまま、村に逃げ帰るわけにもいかない。
ここでケリを付けたいんだが、助勢を頼めないか？
むろん、拙者も応戦する！","手助けする？

<UIForeground>F201F4</UIForeground><UIGlow>F201F5</UIGlow>※このF.A.T.E.の推奨レベルは<Value>IntegerParameter(1)</Value>です。<UIGlow>01</UIGlow><UIForeground>01</UIForeground>","","","","それほどの力がありながら、
義のために、助勢を拒むというのか！？
野武士と同じく、心が荒んでいるということか……。",""
387,1,1,1,1,1,1,1,1,0,0,0,0,0,0,0,0,1,1,1,1,1,1,1,1,0,0,0,0,0,0,0,0,0,0,0,0,0,0,0,0,False,False,False,False,False,False,False,False,0,3,0,0,0,0,0,0,"…………。","詐欺師をたたき出して欲しいようだ。協力する？

<UIForeground>F201F4</UIForeground><UIGlow>F201F5</UIGlow>※このF.A.T.E.の推奨レベルは<Value>IntegerParameter(1)</Value>です。<UIGlow>01</UIGlow><UIForeground>01</UIForeground>","","","","","…………。",""
388,1,1,1,1,1,1,1,1,0,0,0,0,0,0,0,0,1,1,1,1,1,1,1,1,0,0,0,0,0,0,0,0,0,0,0,0,0,0,0,0,False,False,False,False,False,False,False,False,0,0,0,0,0,0,0,0,"騙すより、騙される方が悪いんだよ！
ゴチャゴチャ因縁つけるつもりなら、
お前もブチのめしてやる！","","","","","","",""
389,1,1,1,1,1,1,1,1,0,0,0,0,0,0,0,0,1,1,1,1,1,1,1,1,0,0,0,0,0,0,0,0,0,0,0,0,0,0,0,0,False,False,False,False,False,False,False,False,0,3,0,0,0,0,0,0,"紅甲羅の連中に、お宝を奪われちまってなぁ～。
取り返しにきたんだが、数が多くて手出しできないんだぁ～。
腕に覚えがあるなら、奪還してはくれんかねぇ～。","奪還に協力する？

<UIForeground>F201F4</UIForeground><UIGlow>F201F5</UIGlow>※このF.A.T.E.の推奨レベルは<Value>IntegerParameter(1)</Value>です。<UIGlow>01</UIGlow><UIForeground>01</UIForeground>","","","本当かい～？
「略奪された宝物」は、紅甲羅たちが持っているか、
奴らの溜まり場に置いてあるはずだよぉ～。","","そうかい……残念だよぉ……。
悲しいなぁ～。",""
390,1,1,1,1,1,1,1,1,0,0,0,0,0,0,0,0,1,1,1,1,1,1,1,1,0,0,0,0,0,0,0,0,0,0,0,0,0,0,0,0,False,False,False,False,False,False,False,False,0,2,0,0,0,0,0,0,"「略奪された宝物」を、取り戻してくれたのかい～？","","","","うわぁ、これだよ、これだよぉ～！
まだ数があるはずだから、もっと見つけたら、
持って来てねぇ～。","","もう少し、集めて来てくれるのかい～？
頼んだよぉ～。",""
391,1,1,1,1,1,1,1,1,0,0,0,0,0,0,0,0,1,1,1,1,1,1,1,1,0,0,0,0,0,0,0,0,0,0,0,0,0,0,0,0,False,False,False,False,False,False,False,False,0,0,0,0,0,0,0,0,"「略奪された宝物」は、紅甲羅たちが持っているか、
奴らの溜まり場に置いてあるはずだよぉ～。","","","","","","",""
392,1,1,1,1,1,1,1,1,0,0,0,0,0,0,0,0,1,1,1,1,1,1,1,1,0,0,0,0,0,0,0,0,0,0,0,0,0,0,0,0,False,False,False,False,False,False,False,False,0,2,0,0,0,0,0,0,"「略奪された宝物」を、取り戻してくれたのかい～？","","","","これだけ取り戻せれば、十分だぁ～。
わざわざ手助けしてくれて、ありがとなぁ～！
そろそろ碧のタマミズに帰るとするよぉ～！","","そろそろ碧のタマミズに帰るとするよぉ～！
「略奪された宝物」を持っているなら、
早めに渡してくれなぁ～。",""
393,1,1,1,1,1,1,1,1,0,0,0,0,0,0,0,0,1,1,1,1,1,1,1,1,0,0,0,0,0,0,0,0,0,0,0,0,0,0,0,0,False,False,False,False,False,False,False,False,0,0,0,0,0,0,0,0,"そろそろ碧のタマミズに帰るとするよぉ～！
「略奪された宝物」を持っているなら、
早めに渡してくれなぁ～。","","","","","","",""
394,2,2,2,2,2,2,2,2,0,0,0,0,0,0,0,0,1,1,1,1,1,1,1,1,0,0,0,0,0,0,0,0,0,0,0,0,0,0,0,0,False,False,False,False,False,False,False,False,0,3,0,0,0,0,0,0,"羊たちに水を飲ませようとしていたら、
屈強な男たちに、無理矢理ここにつれてこられて……。
どうかボクを助けておくれよ！","モル族の羊飼いを助ける？

<UIForeground>F201F4</UIForeground><UIGlow>F201F5</UIGlow>※このF.A.T.E.の推奨レベルは<Value>IntegerParameter(1)</Value>です。<UIGlow>01</UIGlow><UIForeground>01</UIForeground>","","","う、うわっ……奴らが戻ってきた！
奴らに誘拐されたら、ボクもブドゥガ族にされちゃうよ！
た、助けてっ！","","そ、そんなぁ……。
このまま奴らに誘拐されたら、
ボクもブドゥガ族にされちゃうんだよ！？",""
395,2,2,2,2,2,2,2,2,0,0,0,0,0,0,0,0,1,1,1,1,1,1,1,1,0,0,0,0,0,0,0,0,0,0,0,0,0,0,0,0,False,False,False,False,False,False,False,False,0,0,0,0,0,0,0,0,"元アラミゴ王家付き書記官、アンセロットがここに記す。
宗教行事を禁じた帝国軍の目を盗み、
どうにかここにやって来た。","歴代の王家の人々を埋葬した、荘厳なる霊廟……
「列王の詩」の様子を確認に来たのだが、こうも荒れているとは！","","","","","",""
396,2,2,2,2,2,2,2,2,0,0,0,0,0,0,0,0,1,1,1,1,1,1,1,1,0,0,0,0,0,0,0,0,0,0,0,0,0,0,0,0,False,False,False,False,False,False,False,False,0,0,0,0,0,0,0,0,"鎮魂の儀式が途絶えたためか、死霊の姿が散見される。
供養に来ないアラミゴの民を恨んでいるのか、
いずれも荒れ狂っているようだ。","どうにか荒ぶる魂を鎮めようと試みたが、失敗に終わった。
悔しいが、ここは身を隠して、やり過ごすしかなさそうだ。","","","","","",""
397,2,2,2,2,2,2,2,2,0,0,0,0,0,0,0,0,1,1,1,1,1,1,1,1,0,0,0,0,0,0,0,0,0,0,0,0,0,0,0,0,False,False,False,False,False,False,False,False,0,0,0,0,0,0,0,0,"隠れ潜んでいたものの、発見され、襲われ、深手を負った。
だが、私のことなど、どうでもいい！","問題は、あの死霊がまとっていた衣だ。
あれは「マンフレッド王」のものではなかったか！？
","誰か、強健王の魂を浄化してくれ、それだけが私の願いだ……。","","","","",""
398,1,1,1,1,1,1,1,1,0,0,0,0,0,0,0,0,1,1,1,1,1,1,1,1,0,0,0,0,0,0,0,0,0,0,0,0,0,0,0,0,False,False,False,False,False,False,False,False,0,3,0,0,0,0,0,0,"ハァ、ハァ、ハァ……そ、そこな旅のお方……
恐ろしい悪漢どもに、追われているのです……。
どうか、お助けいただけませんか？","少女を助けますか？

<UIForeground>F201F4</UIForeground><UIGlow>F201F5</UIGlow>※このF.A.T.E.の推奨レベルは<Value>IntegerParameter(1)</Value>です。<UIGlow>01</UIGlow><UIForeground>01</UIForeground>","","","あ、ありがとうございます！","","なんと、もはやこれまで……
しかし無理強いはできません……。
どうか、あなただけでも、お逃げください。",""
399,2,2,2,2,2,2,2,2,0,0,0,0,0,0,0,0,1,1,1,1,1,1,1,1,0,0,0,0,0,0,0,0,0,0,0,0,0,0,0,0,False,False,False,False,False,False,False,False,0,0,3,0,0,0,0,0,"おお、旅のお方！
よい時にお声掛けくださった！","あの食いしん坊のナマズオたちを、懲らしめてくれ！
わしの大切な供物を、荒らしておるのだ！","少女を助けますか？

<UIForeground>F201F4</UIForeground><UIGlow>F201F5</UIGlow>※このF.A.T.E.の推奨レベルは<Value>IntegerParameter(1)</Value>です。<UIGlow>01</UIGlow><UIForeground>01</UIForeground>","","おお、なんと頼もしいことか！
それではナマズオたちから、奪われた供物を取り返し、
わしのところまで、届けてくだされ！","","ご無体な……いや、そもそも供物を奪われるがまま、
反撃すらできぬ、おのれの弱さが悪いのか……。",""
400,1,1,1,1,1,1,1,1,0,0,0,0,0,0,0,0,1,1,1,1,1,1,1,1,0,0,0,0,0,0,0,0,0,0,0,0,0,0,0,0,False,False,False,False,False,False,False,False,0,0,0,0,0,0,0,0,"奪われた供物は取り戻せましたかな？
あの食いしん坊のナマズオたちが持っているハズ……。
どうか、よろしくお頼み申す！","","","","","","",""
401,1,1,1,1,1,1,1,1,0,0,0,0,0,0,0,0,1,1,1,1,1,1,1,1,0,0,0,0,0,0,0,0,0,0,0,0,0,0,0,0,False,False,False,False,False,False,False,False,0,2,0,0,0,0,0,0,"おお、奪われた供物を取り戻してくださったか！
ではでは、さっそくわしに渡してくだされ！","","","","ありがたい！
しかし、まだ供物は残っているはず……。
また取り返したら、わしのところまで届けてくだされ！","","なにやら芳しい香りがした気がしたが、
気のせいであったか……。",""
402,1,1,1,1,1,1,1,1,0,0,0,0,0,0,0,0,1,1,1,1,1,1,1,1,0,0,0,0,0,0,0,0,0,0,0,0,0,0,0,0,False,False,False,False,False,False,False,False,0,0,0,0,0,0,0,0,"かなりの量を取り戻すことができたが、
もしも、供物を見つけた時には、わしに届けてくだされ！","","","","","","",""
403,1,1,1,1,1,1,1,1,0,0,0,0,0,0,0,0,1,1,1,1,1,1,1,1,0,0,0,0,0,0,0,0,0,0,0,0,0,0,0,0,False,False,False,False,False,False,False,False,0,2,0,0,0,0,0,0,"おお、奪われた供物を取り戻してくださったか！
ではでは、さっそくわしに渡してくだされ！","","","","ありがたい！
これだけ取り戻すことができれば充分だろう！
おぬしの尽力に感謝するぞ！","","しかし、あのナマズオたちめ……
あれだけの供物を、一気に運び去るとは、
おそるべき貪欲さよな……。",""
404,1,1,1,1,1,1,1,1,0,0,0,0,0,0,0,0,1,1,1,1,1,1,1,1,0,0,0,0,0,0,0,0,0,0,0,0,0,0,0,0,False,False,False,False,False,False,False,False,0,3,0,0,0,0,0,0,"それ以上近づくな……
妾は……妾は……！","仲裁に入りますか？

<UIForeground>F201F4</UIForeground><UIGlow>F201F5</UIGlow>※このF.A.T.E.の推奨レベルは<Value>IntegerParameter(1)</Value>です。<UIGlow>01</UIGlow><UIForeground>01</UIForeground>","","","","","早く離れるのじゃ……！
もう妖気を抑えることが……妾から離れるのじゃ！",""
405,1,1,1,1,1,1,1,1,0,0,0,0,0,0,0,0,1,1,1,1,1,1,1,1,0,0,0,0,0,0,0,0,0,0,0,0,0,0,0,0,False,False,False,False,False,False,False,False,0,0,0,0,0,0,0,0,"おや、こんなところに旅の方とは珍しいねぇ。
あんたさんも、お狐様の祠にお詣りにきたのかい？","帝国軍が来てから、詣でるのも禁じられちまって、
ここに来るのは、この婆さんひとりくらいなものさね……。
だから、こんなにも荒れ果ててしまったよぉ。","何百年も昔のこと、当時のお殿様が、
山で助けたお狐様のために、この祠を作ったそうでねぇ。
それ以来、ずっとお狐様は、ヤンサを護ってくだすってるのさ。","","","","",""
406,1,1,1,1,1,1,1,1,0,0,0,0,0,0,0,0,1,1,1,1,1,1,1,1,0,0,0,0,0,0,0,0,0,0,0,0,0,0,0,0,False,False,False,False,False,False,False,False,0,0,3,0,0,0,0,0,"あ、あ、ありがとう……！
でも、ブドゥガ族が、そう簡単に諦めるとは思えないよ！","どうかお願いだから、
ボクをモル・イローの近くまで送り届けて！
絶対に、ブドゥガ族にはなりたくないんだよっ！","モル・イローまで護衛する？

<UIForeground>F201F4</UIForeground><UIGlow>F201F5</UIGlow>※このF.A.T.E.の推奨レベルは<Value>IntegerParameter(1)</Value>です。<UIGlow>01</UIGlow><UIForeground>01</UIForeground>","","","","そ、そんなぁ……。
このまま奴らに誘拐されたら、
ボクもブドゥガ族にされちゃうんだよ！？",""
407,0,0,0,0,0,0,0,0,0,0,0,0,0,0,0,0,1,1,1,1,1,1,1,1,0,0,0,0,0,0,0,0,0,0,0,0,0,0,0,0,False,False,False,False,False,False,False,False,0,0,0,0,0,0,0,0,"オラオラ！
どこを見ている！","","","","","","",""
408,0,0,0,0,0,0,0,0,0,0,0,0,0,0,0,0,1,1,1,1,1,1,1,1,0,0,0,0,0,0,0,0,0,0,0,0,0,0,0,0,False,False,False,False,False,False,False,False,0,0,0,0,0,0,0,0,"いけ！
気合いを入れろ！","","","","","","",""
409,0,0,0,0,0,0,0,0,0,0,0,0,0,0,0,0,1,1,1,1,1,1,1,1,0,0,0,0,0,0,0,0,0,0,0,0,0,0,0,0,False,False,False,False,False,False,False,False,0,0,0,0,0,0,0,0,"強気で攻めろ！","","","","","","",""
410,2,2,2,2,2,2,2,2,0,0,0,0,0,0,0,0,1,1,1,1,1,1,1,1,0,0,0,0,0,0,0,0,0,0,0,0,0,0,0,0,False,False,False,False,False,False,False,False,0,0,0,0,0,0,0,0,"この辺りは、地元民にとってはいい漁場なんだが、
時折、強い潮風に乗って、トビザメが遡上してくるんだ。
そうなると漁場が荒らされて、もう大変さ……。","","","","","","",""
411,2,2,2,2,2,2,2,2,0,0,0,0,0,0,0,0,1,1,1,1,1,1,1,1,0,0,0,0,0,0,0,0,0,0,0,0,0,0,0,0,False,False,False,False,False,False,False,False,0,0,0,0,0,0,0,0,"あ、あれは、食い物あるところに現れて、
根こそぎ食べちまう、「扶持狩り（ふちかり）」だよ！
あんなのが出たんじゃ、やっぱり漁は無理ってもんだ！","","","","","","",""
412,1,1,1,1,1,1,1,1,0,0,0,0,0,0,0,0,1,1,1,1,1,1,1,1,0,0,0,0,0,0,0,0,0,0,0,0,0,0,0,0,False,False,False,False,False,False,False,False,0,0,0,0,0,0,0,0,"死んだ婆さんから聞いたことがある！
恐ろしいほどの大きく、人を襲うミノビのことをな……
確か名前は、「釣瓶火（つるべび）」だったはずだ！","","","","","","",""
413,1,1,1,1,1,1,1,1,0,0,0,0,0,0,0,0,1,1,1,1,1,1,1,1,0,0,0,0,0,0,0,0,0,0,0,0,0,0,0,0,False,False,False,False,False,False,False,False,0,0,0,0,0,0,0,0,"先ほど助け出した狩人は、ゴロ族のようだ。
彼らは馬を神聖視し、愛馬と結婚するという。
しかし、彼女はひとりだった……きっとマンモスたちに……。","","","","","","",""
414,1,1,1,1,1,1,1,1,0,0,0,0,0,0,0,0,1,1,1,1,1,1,1,1,0,0,0,0,0,0,0,0,0,0,0,0,0,0,0,0,False,False,False,False,False,False,False,False,0,0,0,0,0,0,0,0,"マンモスに襲われていたゴロ族の狩人なら、
今は眠っているわ……。","","","","","","",""
415,0,0,0,0,0,0,0,0,0,0,0,0,0,0,0,0,1,1,1,1,1,1,1,1,0,0,0,0,0,0,0,0,0,0,0,0,0,0,0,0,False,False,False,False,False,False,False,False,0,0,0,0,0,0,0,0,"どうだい、綺麗な馬だろう？
あのゴロ族の狩人が、婿に欲しいと言ったって、
絶対に譲ってやらないからな！","","","","","","",""
416,0,0,0,0,0,0,0,0,0,0,0,0,0,0,0,0,1,1,1,1,1,1,1,1,0,0,0,0,0,0,0,0,0,0,0,0,0,0,0,0,False,False,False,False,False,False,False,False,0,0,0,0,0,0,0,0,"羊の様子がおかしいの……
なんだか不安そうにしていて……。","","","","","","",""
417,1,1,1,1,1,1,1,1,0,0,0,0,0,0,0,0,1,1,1,1,1,1,1,1,0,0,0,0,0,0,0,0,0,0,0,0,0,0,0,0,False,False,False,False,False,False,False,False,0,0,0,0,0,0,0,0,"我らダタク族は、草原を移動しながら生活している。
あまりに長く旅をするため、ほかの部族の者からは、
大げさに、馬上で眠る民と呼ばれるほどだ。","","","","","","",""
418,0,0,0,0,0,0,0,0,0,0,0,0,0,0,0,0,1,1,1,1,1,1,1,1,0,0,0,0,0,0,0,0,0,0,0,0,0,0,0,0,False,False,False,False,False,False,False,False,0,0,0,0,0,0,0,0,"天幕を張り、居留地を築いたとしても、
このアジムステップでは、油断はできない……。","危険な獣は、家畜どころか、
私たちすら獲物にしてやろうと狙っているのだから。","","","","","",""
419,1,1,1,1,1,1,1,1,0,0,0,0,0,0,0,0,1,1,1,1,1,1,1,1,0,0,0,0,0,0,0,0,0,0,0,0,0,0,0,0,False,False,False,False,False,False,False,False,0,0,0,0,0,0,0,0,"異人の旅人さんかい？
俺たちダタク族も、旅から旅の生活さ。
ここで会ったのも何かの縁……仲良くやろうぜ！","","","","","","",""
420,0,0,0,0,0,0,0,0,0,0,0,0,0,0,0,0,1,1,1,1,1,1,1,1,0,0,0,0,0,0,0,0,0,0,0,0,0,0,0,0,False,False,False,False,False,False,False,False,0,0,0,0,0,0,0,0,"アタシ、戦いは好きじゃないけど、
可愛い家畜たちを守るためなら、槍を取るわ！","","","","","","",""
421,1,1,1,1,1,1,1,1,0,0,0,0,0,0,0,0,1,1,1,1,1,1,1,1,0,0,0,0,0,0,0,0,0,0,0,0,0,0,0,0,False,False,False,False,False,False,False,False,0,0,3,0,0,0,0,0,"あら、ようこそ旅人さん。
大草原では、旅人との出会いは貴重だから、
アナタに会えて嬉しいわ！","これから羊の乳搾りをするつもりだけど、
よかったら、アナタもいっしょにやってみない？
とっても楽しいわよ！","乳搾りを手伝う？

<UIForeground>F201F4</UIForeground><UIGlow>F201F5</UIGlow>※このF.A.T.E.の推奨レベルは<Value>IntegerParameter(1)</Value>です。<UIGlow>01</UIGlow><UIForeground>01</UIForeground>","","「新鮮な羊乳」が搾れたら、
アタシに手渡してね！","","もしかして、羊たちが嫌いとか？
こんなに可愛いのに……。",""
422,1,1,1,1,1,1,1,1,0,0,0,0,0,0,0,0,1,1,1,1,1,1,1,1,0,0,0,0,0,0,0,0,0,0,0,0,0,0,0,0,False,False,False,False,False,False,False,False,0,2,0,0,0,0,0,0,"「新鮮な羊乳」が搾れたら、
アタシに手渡してね！","","","","ありがとう、なかなか上手じゃない！
どう、美味しそうな羊乳でしょ？
そのまま飲んでもいいし、お酒やチーズにもするのよ！","","「新鮮な羊乳」を見たら、飲みたくなっちゃった？
お酒やチーズを作りたいから、渡してほしいんだけど……。",""
423,1,1,1,1,1,1,1,1,0,0,0,0,0,0,0,0,1,1,1,1,1,1,1,1,0,0,0,0,0,0,0,0,0,0,0,0,0,0,0,0,False,False,False,False,False,False,False,False,0,2,0,0,0,0,0,0,"「新鮮な羊乳」が搾れたら、
アタシに手渡してね！","","","","ありがとう、なかなか上手じゃない！
これだけあれば、お酒は十分に作れそう。
後はチーズのぶんがあると最高ね！","","「新鮮な羊乳」を見たら、飲みたくなっちゃった？
チーズを作りたいから、渡してほしいんだけど……。",""
424,1,1,1,1,1,1,1,1,0,0,0,0,0,0,0,0,1,1,1,1,1,1,1,1,0,0,0,0,0,0,0,0,0,0,0,0,0,0,0,0,False,False,False,False,False,False,False,False,0,0,0,0,0,0,0,0,"「新鮮な羊乳」は搾れた？
ダタク族の羊に優しく接して、搾ってみて！","","","","","","",""
425,1,1,1,1,1,1,1,1,0,0,0,0,0,0,0,0,1,1,1,1,1,1,1,1,0,0,0,0,0,0,0,0,0,0,0,0,0,0,0,0,False,False,False,False,False,False,False,False,0,0,0,0,0,0,0,0,"「新鮮な羊乳」は搾れた？
ダタク族の羊に優しく接して、搾ってみて！","","","","","","",""
426,0,0,0,0,0,0,0,0,0,0,0,0,0,0,0,0,1,1,1,1,1,1,1,1,0,0,0,0,0,0,0,0,0,0,0,0,0,0,0,0,False,False,False,False,False,False,False,False,0,0,0,0,0,0,0,0,"さてと、塩と香辛料を用意しておかないと……。
アナーバの狩りが成功し、ケナガウシの肉が手に入ったら、
ホルホグという蒸し焼き料理を作るつもりなの。","","","","","","",""
427,0,0,0,0,0,0,0,0,0,0,0,0,0,0,0,0,1,1,1,1,1,1,1,1,0,0,0,0,0,0,0,0,0,0,0,0,0,0,0,0,False,False,False,False,False,False,False,False,0,0,0,0,0,0,0,0,"アナーバお兄ちゃんが、ケナガウシの群れを見つけて、
狩りに出かけたんだけど、大丈夫かな……？","","","","","","",""
428,0,0,0,0,0,0,0,0,0,0,0,0,0,0,0,0,1,1,1,1,1,1,1,1,0,0,0,0,0,0,0,0,0,0,0,0,0,0,0,0,False,False,False,False,False,False,False,False,0,0,0,0,0,0,0,0,"今のうちに、弓の弦を張り替えないと……。
予備の腱は、どこにやったかしら？","","","","","","",""
429,1,1,1,1,1,1,1,1,0,0,0,0,0,0,0,0,1,1,1,1,1,1,1,1,0,0,0,0,0,0,0,0,0,0,0,0,0,0,0,0,False,False,False,False,False,False,False,False,0,0,0,0,0,0,0,0,"この子、絶対に人の手で飼われていた馬だよ。
人のことを恐れないし、馬具を付けた跡もあるもの。
飼い主さん、きっと心配しているだろうな……。","","","","","","",""
430,1,1,1,1,1,1,1,1,0,0,0,0,0,0,0,0,1,1,1,1,1,1,1,1,0,0,0,0,0,0,0,0,0,0,0,0,0,0,0,0,False,False,False,False,False,False,False,False,0,0,0,0,0,0,0,0,"交代して、見張りをしているところでな……。
旅人殿も、手を貸してくれると、ありがたい……。","","","","","","",""
431,1,1,1,1,1,1,1,1,0,0,0,0,0,0,0,0,1,1,1,1,1,1,1,1,0,0,0,0,0,0,0,0,0,0,0,0,0,0,0,0,False,False,False,False,False,False,False,False,0,0,0,0,0,0,0,0,"あのマンモスみたいな獣人、マタンガ族は、
理由は定かじゃ無いけど、アウラ族を憎んでいてね……。
捕食するためでもなく、ただ殺すために襲ってくるのよ。","","","","","","",""
432,0,0,0,0,0,0,0,0,0,0,0,0,0,0,0,0,1,1,1,1,1,1,1,1,0,0,0,0,0,0,0,0,0,0,0,0,0,0,0,0,False,False,False,False,False,False,False,False,0,0,0,0,0,0,0,0,"ゴロ族って、馬と結婚するんだろ？
んで、子作りの相手はクジで決めるって……。
グルベスの相手も、もう決まってんのかな……。","","","","","","",""
433,0,0,0,0,0,0,0,0,0,0,0,0,0,0,0,0,1,1,1,1,1,1,1,1,0,0,0,0,0,0,0,0,0,0,0,0,0,0,0,0,False,False,False,False,False,False,False,False,0,0,0,0,0,0,0,0,"アナーバお兄ちゃん、
グルベスさんのこと気にしてるみたい……。
ふふっ、わかりやすいんだから！","","","","","","",""
434,0,0,0,0,0,0,0,0,0,0,0,0,0,0,0,0,1,1,1,1,1,1,1,1,0,0,0,0,0,0,0,0,0,0,0,0,0,0,0,0,False,False,False,False,False,False,False,False,0,0,0,0,0,0,0,0,"しっかりして、傷の手当は済んだわ！","","","","","","",""
435,0,0,0,0,0,0,0,0,0,0,0,0,0,0,0,0,1,1,1,1,1,1,1,1,0,0,0,0,0,0,0,0,0,0,0,0,0,0,0,0,False,False,False,False,False,False,False,False,0,0,0,0,0,0,0,0,"おのれ、マタンガ族め……
我らがいったい何をしたというのだ……！","","","","","","",""
436,1,1,1,1,1,1,1,1,0,0,0,0,0,0,0,0,1,1,1,1,1,1,1,1,0,0,0,0,0,0,0,0,0,0,0,0,0,0,0,0,False,False,False,False,False,False,False,False,0,0,3,0,0,0,0,0,"グッ……水汲みに来ていた同胞が、
野獣に襲われていたものでな……。
助けようとしたが、力及ばず……。","情けない頼みなのは、
百も承知だが、助太刀を頼めないか……！？
奴らを見逃すわけには、いかないんだ！","助太刀する？

<UIForeground>F201F4</UIForeground><UIGlow>F201F5</UIGlow>※このF.A.T.E.の推奨レベルは<Value>IntegerParameter(1)</Value>です。<UIGlow>01</UIGlow><UIForeground>01</UIForeground>","","","","そうか……。
ならば、このまま死ぬ覚悟で、
ひとり挑むしかあるまいな……！",""
437,1,1,1,1,1,1,1,1,0,0,0,0,0,0,0,0,1,1,1,1,1,1,1,1,0,0,0,0,0,0,0,0,0,0,0,0,0,0,0,0,False,False,False,False,False,False,False,False,0,0,3,0,0,0,0,0,"調理するために、大量の魚を運んで来たんだけど、
その匂いをスニッパーどもが、嗅ぎつけたようなんだ……。","もしも魚を食べられちまったら、商売あがったりだよ。
お願いだ、魔物退治を請け負ってくれないかい？","魔物退治を請け負う？

<UIForeground>F201F4</UIForeground><UIGlow>F201F5</UIGlow>※このF.A.T.E.の推奨レベルは<Value>IntegerParameter(1)</Value>です。<UIGlow>01</UIGlow><UIForeground>01</UIForeground>","","ありがとう……！
頼りにしているよ、冒険者さん！","","そ、そんな……！
この魚を仕入れるのに、大金を使ったんだよ！？",""
438,1,1,1,1,1,1,1,1,0,0,0,0,0,0,0,0,1,1,1,1,1,1,1,1,0,0,0,0,0,0,0,0,0,0,0,0,0,0,0,0,False,False,False,False,False,False,False,False,0,0,3,0,0,0,0,0,"やれやれ、客が多いのはいいことだが、
こうも汚されてしまうと、せっかくの景観が台無しだ。
ゲゲルジュ氏も、悲しむことだろう。","すまないが君……美しさを取り戻すためにも、
ゴミ集めに協力してもらえないか？","ゴミ集めを手伝う？

<UIForeground>F201F4</UIForeground><UIGlow>F201F5</UIGlow>※このF.A.T.E.の推奨レベルは<Value>IntegerParameter(1)</Value>です。<UIGlow>01</UIGlow><UIForeground>01</UIForeground>","","そうか、やってくれるか！
ゴミを食い荒らそうとする、コリブリもいるようでな。
見つけたら、力尽くで追い払ってくれよ。","","そうか、残念だよ……。
さて、これだけの量のゴミをどうしたものか……。",""
439,1,1,1,1,1,1,1,1,0,0,0,0,0,0,0,0,1,1,1,1,1,1,1,1,0,0,0,0,0,0,0,0,0,0,0,0,0,0,0,0,False,False,False,False,False,False,False,False,0,2,0,0,0,0,0,0,"「紅蓮祭のゴミ」は、集めて来てくれたか？","","","","ありがとう！
まだゴミが残っているようなら、持って来てくれ。","","ふむ、そのゴミを持ち帰ろうと？
それなら構わないが……。",""
440,1,1,1,1,1,1,1,1,0,0,0,0,0,0,0,0,1,1,1,1,1,1,1,1,0,0,0,0,0,0,0,0,0,0,0,0,0,0,0,0,False,False,False,False,False,False,False,False,0,0,0,0,0,0,0,0,"せっかくの景観なのだから、
美しく保ちたいのが人情というものだろう？","","","","","","",""
441,1,1,1,1,1,1,1,1,0,0,0,0,0,0,0,0,1,1,1,1,1,1,1,1,0,0,0,0,0,0,0,0,0,0,0,0,0,0,0,0,False,False,False,False,False,False,False,False,0,2,0,0,0,0,0,0,"おお、またゴミを集めて来てくれたのか！","","","","ありがとう！
おかげで美しい景観が戻ってきたよ。","","ふむ、そのゴミを持ち帰ろうと？
それなら構わないが……。",""
