key,0,1,2,3,4,5,6,7,8,9,10,11,12,13,14,15,16,17,18,19,20,21,22,23,24,25,26,27,28,29,30,31,32,33,34,35,36,37,38,39,40,41,42,43,44,45,46,47,48,49,50,51,52,53,54,55,56,57,58,59,60,61,62,63
#,Turn[0],Turn[1],Turn[2],Turn[3],Turn[4],Turn[5],Turn[6],Turn[7],Gesture[0],Gesture[1],Gesture[2],Gesture[3],Gesture[4],Gesture[5],Gesture[6],Gesture[7],LipSync[0],LipSync[1],LipSync[2],LipSync[3],LipSync[4],LipSync[5],LipSync[6],LipSync[7],Facial[0],Facial[1],Facial[2],Facial[3],Facial[4],Facial[5],Facial[6],Facial[7],Shape[0],Shape[1],Shape[2],Shape[3],Shape[4],Shape[5],Shape[6],Shape[7],IsAutoShake[0],IsAutoShake[1],IsAutoShake[2],IsAutoShake[3],IsAutoShake[4],IsAutoShake[5],IsAutoShake[6],IsAutoShake[7],WidgetType[0],WidgetType[1],WidgetType[2],WidgetType[3],WidgetType[4],WidgetType[5],WidgetType[6],WidgetType[7],Text[0],Text[1],Text[2],Text[3],Text[4],Text[5],Text[6],Text[7]
int32,byte,byte,byte,byte,byte,byte,byte,byte,uint32,uint32,uint32,uint32,uint32,uint32,uint32,uint32,int32,int32,int32,int32,int32,int32,int32,int32,int32,int32,int32,int32,int32,int32,int32,int32,int32,int32,int32,int32,int32,int32,int32,int32,bit&01,bit&01,bit&01,bit&01,bit&01,bit&01,bit&01,bit&01,byte,byte,byte,byte,byte,byte,byte,byte,str,str,str,str,str,str,str,str
0,2,2,2,2,2,2,2,2,0,0,0,0,0,0,0,0,1,1,1,1,1,1,1,1,0,0,0,0,0,0,0,0,0,0,0,0,0,0,0,0,False,False,False,False,False,False,False,False,0,0,0,0,0,0,0,0,"","","","","","","",""
1,0,0,0,0,0,0,0,0,0,0,0,0,0,0,0,0,0,0,0,0,0,0,0,0,0,0,0,0,0,0,0,0,0,0,0,0,0,0,0,0,False,False,False,False,False,False,False,False,0,0,0,0,0,0,0,0,"","","","","","","",""
2,0,0,0,0,0,0,0,0,0,0,0,0,0,0,0,0,0,0,0,0,0,0,0,0,0,0,0,0,0,0,0,0,0,0,0,0,0,0,0,0,False,False,False,False,False,False,False,False,0,0,0,0,0,0,0,0,"","","","","","","",""
3,0,0,0,0,0,0,0,0,0,0,0,0,0,0,0,0,0,0,0,0,0,0,0,0,0,0,0,0,0,0,0,0,0,0,0,0,0,0,0,0,False,False,False,False,False,False,False,False,0,0,0,0,0,0,0,0,"","","","","","","",""
4,2,2,2,2,2,2,2,2,0,0,0,0,0,0,0,0,1,1,1,1,1,1,1,1,0,0,0,0,0,0,0,0,0,0,0,0,0,0,0,0,False,False,False,False,False,False,False,False,0,3,0,0,0,0,0,0,"君！　収穫を手伝ってくれないか！急がないと大切な果実をオポオポに取られてしまうよ！","収穫を手伝いますか？

<UIForeground>F201F4</UIForeground><UIGlow>F201F5</UIGlow>※このF.A.T.E.の推奨レベルは<Value>IntegerParameter(1)</Value>です。<UIGlow>01</UIGlow><UIForeground>01</UIForeground>","","","頼んだよ！","","そうかい。じゃあ、ほかの人に頼むよ。",""
5,2,2,2,2,2,2,2,2,0,0,0,0,0,0,0,0,1,1,1,1,1,1,1,1,0,0,0,0,0,0,0,0,0,0,0,0,0,0,0,0,False,False,False,False,False,False,False,False,0,2,0,0,0,0,0,0,"果実を持ってきてくれたのかい？","","","","ありがとう！","","おや、違うのかい。",""
6,2,2,2,2,2,2,2,2,0,0,0,0,0,0,0,0,1,1,1,1,1,1,1,1,0,0,0,0,0,0,0,0,0,0,0,0,0,0,0,0,False,False,False,False,False,False,False,False,0,0,0,0,0,0,0,0,"果実を集めて持ってきてくれ！","","","","","","",""
7,2,2,2,2,2,2,2,2,0,0,0,0,0,0,0,0,1,1,1,1,1,1,1,1,0,0,0,0,0,0,0,0,0,0,0,0,0,0,0,0,False,False,False,False,False,False,False,False,0,0,3,0,0,0,0,0,"ぐぬぬ、小賢しい密猟者め！
奴ら、獲物を隠して密猟行為をしらばっくれるつもりだ。","我々鬼哭隊の目は欺けんぞ！
冒険者よ、密猟者から証拠の品を集めるために
我らに力を貸してくれ！","証拠を集めてきますか？

<UIForeground>F201F4</UIForeground><UIGlow>F201F5</UIGlow>※このF.A.T.E.の推奨レベルは<Value>IntegerParameter(1)</Value>です。<UIGlow>01</UIGlow><UIForeground>01</UIForeground>","","よし、頼んだぞ！","","ううむ、仕方ない……。
我々だけでも証拠を掴んでみせる！",""
8,2,2,2,2,2,2,2,2,0,0,0,0,0,0,0,0,1,1,1,1,1,1,1,1,0,0,0,0,0,0,0,0,0,0,0,0,0,0,0,0,False,False,False,False,False,False,False,False,0,2,0,0,0,0,0,0,"密猟の証拠を持ってきてくれたのか？","","","","よくやった。また見つけたら持ってきてくれ。","","そうか、見つけたらすぐ持ってきてくれ。",""
9,2,2,2,2,2,2,2,2,0,0,0,0,0,0,0,0,1,1,1,1,1,1,1,1,0,0,0,0,0,0,0,0,0,0,0,0,0,0,0,0,False,False,False,False,False,False,False,False,0,0,0,0,0,0,0,0,"密猟者が狩りを行った証拠を持ってきてくれ！","","","","","","",""
10,2,2,2,2,2,2,2,2,0,0,0,0,0,0,0,0,1,1,1,1,1,1,1,1,0,0,0,0,0,0,0,0,0,0,0,0,0,0,0,0,False,False,False,False,False,False,False,False,0,0,3,0,0,0,0,0,"おのれゴブリン族め……
油断していたとはいえ、商品を根こそぎ奪われるとは……。","そこの冒険者！
にっくきゴブリン族どもから、
私の商品を取り戻してきてくれないか！？","商品を取り戻してきますか？

<UIForeground>F201F4</UIForeground><UIGlow>F201F5</UIGlow>※このF.A.T.E.の推奨レベルは<Value>IntegerParameter(1)</Value>です。<UIGlow>01</UIGlow><UIForeground>01</UIForeground>","","やつらに思い知らせてやってくれ！","","ふん、お前の顔、覚えておいたからな！",""
11,2,2,2,2,2,2,2,2,0,0,0,0,0,0,0,0,1,1,1,1,1,1,1,1,0,0,0,0,0,0,0,0,0,0,0,0,0,0,0,0,False,False,False,False,False,False,False,False,0,2,0,0,0,0,0,0,"おお、私の商品たちは無事か？","","","","もっとあったはずだ！
全部、取り戻すんだ！","","ええい、口を動かすな！　手を動かせ！",""
12,2,2,2,2,2,2,2,2,0,0,0,0,0,0,0,0,1,1,1,1,1,1,1,1,0,0,0,0,0,0,0,0,0,0,0,0,0,0,0,0,False,False,False,False,False,False,False,False,0,0,0,0,0,0,0,0,"ゴブリンに奪われた商品を取り戻してくるんだ！","","","","","","",""
13,2,2,2,2,2,2,2,2,0,0,0,0,0,0,0,0,1,1,1,1,1,1,1,1,0,0,0,0,0,0,0,0,0,0,0,0,0,0,0,0,False,False,False,False,False,False,False,False,0,2,0,0,0,0,0,0,"キミの持っている、その石の欠片……
ワタシに譲ってくれないかね？","譲りますか？","","","ふむ……いい石だ。
もっと見つけたら、また譲ってくれ。","","そうか、残念だ。",""
14,2,2,2,2,2,2,2,2,0,0,0,0,0,0,0,0,1,1,1,1,1,1,1,1,0,0,0,0,0,0,0,0,0,0,0,0,0,0,0,0,False,False,False,False,False,False,False,False,0,0,0,0,0,0,0,0,"ゴーレムの体を構成する石材……
ワタシが今、もっとも注目しているモノだ。","もし見つけたら持ってきてほしい。
よろしく頼むよ。","","","","","",""
15,2,2,2,2,2,2,2,2,0,0,0,0,0,0,0,0,1,1,1,1,1,1,1,1,0,0,0,0,0,0,0,0,0,0,0,0,0,0,0,0,False,False,False,False,False,False,False,False,0,0,0,0,0,0,0,0,"これだけあれば十分だろう。","","","","","","",""
16,2,2,2,2,2,2,2,2,0,0,0,0,0,0,0,0,1,1,1,1,1,1,1,1,0,0,0,0,0,0,0,0,0,0,0,0,0,0,0,0,False,False,False,False,False,False,False,False,0,0,0,0,0,0,0,0,"十分な数が集まった。ありがとう。","","","","","","",""
17,2,2,2,2,2,2,2,2,0,0,0,0,0,0,0,0,1,1,1,1,1,1,1,1,0,0,0,0,0,0,0,0,0,0,0,0,0,0,0,0,False,False,False,False,False,False,False,False,0,0,0,0,0,0,0,0,"ひぃ、ふぅ、みぃ……こんなもんか。","","","","","","",""
18,2,2,2,2,2,2,2,2,0,0,0,0,0,0,0,0,1,1,1,1,1,1,1,1,0,0,0,0,0,0,0,0,0,0,0,0,0,0,0,0,False,False,False,False,False,False,False,False,0,0,0,0,0,0,0,0,"いい石が揃った。満足したよ。","","","","","","",""
19,2,2,2,2,2,2,2,2,0,0,0,0,0,0,0,0,1,1,1,1,1,1,1,1,0,0,0,0,0,0,0,0,0,0,0,0,0,0,0,0,False,False,False,False,False,False,False,False,0,0,0,3,0,0,0,0,"……あ、あの、今いいです？","次の試験が、教官との模擬戦なんですが、
その、班行動でってルールで、その……","ちょっと、たまたま人数が合わなくて、
組む相手を待ってるんですけど、
どうですかね……？","組んであげますか？

<UIForeground>F201F4</UIForeground><UIGlow>F201F5</UIGlow>※このF.A.T.E.の推奨レベルは<Value>IntegerParameter(1)</Value>です。<UIGlow>01</UIGlow><UIForeground>01</UIForeground>","","","はぁ……
もう班行動とかやめてほしい……。",""
20,2,2,2,2,2,2,2,2,0,0,0,0,0,0,0,0,1,1,1,1,1,1,1,1,0,0,0,0,0,0,0,0,0,0,0,0,0,0,0,0,False,False,False,False,False,False,False,False,0,0,0,3,0,0,0,0,"このあたりのツリースラッグは、
ミツバチにとって大切な花を
どんどん食べちゃうんですよ。","最近は数もどんどん増えていて、
集団でやってくるようになったんです。
今日もそろそろ来るんじゃないかな……。","冒険者さん、なんとかしてくれませんか？","なんとかしてあげますか？

<UIForeground>F201F4</UIForeground><UIGlow>F201F5</UIGlow>※このF.A.T.E.の推奨レベルは<Value>IntegerParameter(1)</Value>です。<UIGlow>01</UIGlow><UIForeground>01</UIForeground>","おおっ、さすが！
ほらほら、さっそく来ましたよ！","","このままだと蜂蜜の量にも影響が……。",""
21,2,2,2,2,2,2,2,2,0,0,0,0,0,0,0,0,1,1,1,1,1,1,1,1,0,0,0,0,0,0,0,0,0,0,0,0,0,0,0,0,False,False,False,False,False,False,False,False,0,0,0,0,0,0,0,0,"ツリースラッグをやっつけちゃってください！","","","","","","",""
22,2,2,2,2,2,2,2,2,0,0,0,0,0,0,0,0,1,1,1,1,1,1,1,1,0,0,0,0,0,0,0,0,0,0,0,0,0,0,0,0,False,False,False,False,False,False,False,False,0,0,0,3,0,0,0,0,"君！　冒険者だな！？
助けてくれ、もう限界だっ！","あの酒癖の悪い「スペンサー」のことだ。
酒を呑むと、必ず暴れまわって手がつけられなくなる。
あいつめ、酒場の掟を知らんはずがなかろうに！","今までは、俺が殴られて収まるならと思ってたが、
もう我慢できん……！
頼む、あいつにキツく灸を据えてやってくれ！","引き受けますか？

<UIForeground>F201F4</UIForeground><UIGlow>F201F5</UIGlow>※このF.A.T.E.の推奨レベルは<Value>IntegerParameter(1)</Value>です。<UIGlow>01</UIGlow><UIForeground>01</UIForeground>","","","そ、そんな……。",""
23,2,2,2,2,2,2,2,2,0,0,0,0,0,0,0,0,1,1,1,1,1,1,1,1,0,0,0,0,0,0,0,0,0,0,0,0,0,0,0,0,False,False,False,False,False,False,False,False,0,0,0,0,0,0,0,0,"あの酔っ払いをなんとかしてくれ～！","","","","","","",""
24,2,2,2,2,2,2,2,2,0,0,0,0,0,0,0,0,1,1,1,1,1,1,1,1,0,0,0,0,0,0,0,0,0,0,0,0,0,0,0,0,False,False,False,False,False,False,False,False,3,0,0,0,0,0,0,0,"レッドベリー砦の中に入りますか？","中に入りますか？","","","","","",""
25,2,2,2,2,2,2,2,2,0,0,0,0,0,0,0,0,1,1,1,1,1,1,1,1,0,0,0,0,0,0,0,0,0,0,0,0,0,0,0,0,False,False,False,False,False,False,False,False,0,0,0,3,0,0,0,0,"我々は「密猟者」の取り締まりを行っている。
ここより南方にて、密猟者とゴブリン族が、
取り引きをしていることを突き止めた。","密猟者とゴブリン族は、交渉に失敗したのか
小競り合いを始めたようだ。
……これは好機だぞ。","冒険者、手を貸してくれ。
両者の隙をついて攻め入り、
森の掟を乱す不逞の輩を、きつく成敗してやるのだ！","手伝いますか？

<UIForeground>F201F4</UIForeground><UIGlow>F201F5</UIGlow>※このF.A.T.E.の推奨レベルは<Value>IntegerParameter(1)</Value>です。<UIGlow>01</UIGlow><UIForeground>01</UIForeground>","よし、頼んだぞ！","","森に尽くす機会を逃すとは……。
冒険者とは、わからぬものだな。",""
26,2,2,2,2,2,2,2,2,0,0,0,0,0,0,0,0,1,1,1,1,1,1,1,1,0,0,0,0,0,0,0,0,0,0,0,0,0,0,0,0,False,False,False,False,False,False,False,False,0,0,0,0,0,0,0,0,"森に仇なす不逞の輩を成敗するのだ！","","","","","","",""
27,2,2,2,2,2,2,2,2,0,0,0,0,0,0,0,0,1,1,1,1,1,1,1,1,0,0,0,0,0,0,0,0,0,0,0,0,0,0,0,0,False,False,False,False,False,False,False,False,0,0,3,0,0,0,0,0,"調子にのったキキルンの闇商人どもが偽造品を売り歩いているらしい。（仮）","これ以上被害者を増やさないためにも、やつらが持っている偽造品を回収してきてくれないか？（仮）","偽造品を回収してきますか？（仮）","","よし、頼んだぞ！（仮）","","仕方ない、残念だ。（仮）",""
28,2,2,2,2,2,2,2,2,0,0,0,0,0,0,0,0,1,1,1,1,1,1,1,1,0,0,0,0,0,0,0,0,0,0,0,0,0,0,0,0,False,False,False,False,False,False,False,False,0,2,0,0,0,0,0,0,"やつらから偽造品を回収してきたのか？（仮）","","","","よくやった。また見つけたら持ってきてくれ。（仮）","","そうか、見つけたらすぐ持ってきてくれ。（仮）",""
29,2,2,2,2,2,2,2,2,0,0,0,0,0,0,0,0,1,1,1,1,1,1,1,1,0,0,0,0,0,0,0,0,0,0,0,0,0,0,0,0,False,False,False,False,False,False,False,False,0,0,0,0,0,0,0,0,"闇商人どもが持っている偽造品を回収してきてくれ！（仮）","","","","","","",""
30,2,2,2,2,2,2,2,2,0,0,0,0,0,0,0,0,1,1,1,1,1,1,1,1,0,0,0,0,0,0,0,0,0,0,0,0,0,0,0,0,False,False,False,False,False,False,False,False,0,0,0,0,0,0,0,0,"これだけ回収すれば、しばらくやつらの商売もあがったりだろう。（仮）","","","","","","",""
31,2,2,2,2,2,2,2,2,0,0,0,0,0,0,0,0,1,1,1,1,1,1,1,1,0,0,0,0,0,0,0,0,0,0,0,0,0,0,0,0,False,False,False,False,False,False,False,False,0,0,0,3,0,0,0,0,"冒険者か！？
いいところに！　手を貸してくれ！","ウチの蜂蜜が「インプ」に目をつけられちまったんだ。
奴ら、蜂蜜を奪うだけじゃなく、蜜を守るミツバチにも
攻撃してきやがる。","ああ、そろそろ来るぞ……。
頼むよ、ウチの蜂蜜のために、にっくきインプどもを
メッタメタに返り討ちにしてやってくれ！","引き受けますか？

<UIForeground>F201F4</UIForeground><UIGlow>F201F5</UIGlow>※このF.A.T.E.の推奨レベルは<Value>IntegerParameter(1)</Value>です。<UIGlow>01</UIGlow><UIForeground>01</UIForeground>","","","むむむ……。
このままじゃ、蜂蜜が……。",""
32,2,2,2,2,2,2,2,2,0,0,0,0,0,0,0,0,1,1,1,1,1,1,1,1,0,0,0,0,0,0,0,0,0,0,0,0,0,0,0,0,False,False,False,False,False,False,False,False,0,0,0,3,0,0,0,0,"ふぅ……
ようやく、ラノシアオレンジを摘み終えた。
後は、納品先へ運ぶだけなんだが……","荷を造り終えると決まって
食い意地張ったラットどもが、
オレンジにたかってくるんだ！","だから、頼む！
押し寄せてきたラットどもを根こそぎ倒して、
大事な「オレンジ入りの木箱」を守り抜いてくれ！","守り抜きますか？

<UIForeground>F201F4</UIForeground><UIGlow>F201F5</UIGlow>※このF.A.T.E.の推奨レベルは<Value>IntegerParameter(1)</Value>です。<UIGlow>01</UIGlow><UIForeground>01</UIForeground>","","","そんな……
頼れるのは冒険者ぐらいなのに……",""
33,2,2,2,2,2,2,2,2,0,0,0,0,0,0,0,0,1,1,1,1,1,1,1,1,0,0,0,0,0,0,0,0,0,0,0,0,0,0,0,0,False,False,False,False,False,False,False,False,0,0,0,3,0,0,0,0,"ねえ、私たちに力を貸して。
キキルンに攫われた市民を、助けに行きたいの。","やつらは、攫った市民をアマルジャ族に引き渡す気よ。
今、最後の交渉をしているみたい……。","みんなを奪還できる最後のチャンスよ。
お願い、少しでも多くの力を貸りたいの……！","手を貸しますか？

<UIForeground>F201F4</UIForeground><UIGlow>F201F5</UIGlow>※このF.A.T.E.の推奨レベルは<Value>IntegerParameter(1)</Value>です。<UIGlow>01</UIGlow><UIForeground>01</UIForeground>","","","……っ。わかった、私たちにも銅刃団の意地があるわ。",""
34,2,2,2,2,2,2,2,2,0,0,0,0,0,0,0,0,1,1,1,1,1,1,1,1,0,0,0,0,0,0,0,0,0,0,0,0,0,0,0,0,False,False,False,False,False,False,False,False,0,0,0,0,0,0,0,0,"","","","","","","",""
35,2,2,2,2,2,2,2,2,0,0,0,0,0,0,0,0,1,1,1,1,1,1,1,1,0,0,0,0,0,0,0,0,0,0,0,0,0,0,0,0,False,False,False,False,False,False,False,False,0,0,0,3,0,0,0,0,"集合！！
これより、帝国兵襲撃に備え、
黒渦団新兵の実践訓練を実施するのである！","これは、攻め入る黒渦団の教導隊員を殲滅し、
デネベール関門の突破を食い止める防衛訓練である！","危険な訓練ではあるが、君が希望するなら、
本訓練への参加を認めるのである。","訓練に参加しますか？

<UIForeground>F201F4</UIForeground><UIGlow>F201F5</UIGlow>※このF.A.T.E.の推奨レベルは<Value>IntegerParameter(1)</Value>です。<UIGlow>01</UIGlow><UIForeground>01</UIForeground>","","","ならば、訓練に巻き込まれぬよう
急ぎ、この場から離れるが賢明である！",""
36,2,2,2,2,2,2,2,2,0,0,0,0,0,0,0,0,1,1,1,1,1,1,1,1,0,0,0,0,0,0,0,0,0,0,0,0,0,0,0,0,False,False,False,False,False,False,False,False,0,0,0,3,0,0,0,0,"これはこれは冒険者さん！
なんて運命的なタイミングでいらっしゃいました。","最近、この辺りでモールが大量に繁殖して、
畑をボッコボコの穴だらけにされて困り果てています。","憎たらしいモールを叩きまくって
退治してもらえないでしょうか？","叩きまくってあげますか？

<UIForeground>F201F4</UIForeground><UIGlow>F201F5</UIGlow>※このF.A.T.E.の推奨レベルは<Value>IntegerParameter(1)</Value>です。<UIGlow>01</UIGlow><UIForeground>01</UIForeground>","おお、それはありがたい！
……見てください、早速現れたようです！
よろしくお願いします！","","ですよね……チッ。",""
37,2,2,2,2,2,2,2,2,0,0,0,0,0,0,0,0,1,1,1,1,1,1,1,1,0,0,0,0,0,0,0,0,0,0,0,0,0,0,0,0,False,False,False,False,False,False,False,False,0,0,0,0,0,0,0,0,"憎たらしいモールを叩きまくって
退治してください、お願いします！！","","","","","","",""
38,2,2,2,2,2,2,2,2,0,0,0,0,0,0,0,0,1,1,1,1,1,1,1,1,0,0,0,0,0,0,0,0,0,0,0,0,0,0,0,0,False,False,False,False,False,False,False,False,0,0,0,3,0,0,0,0,"お前、腕に自信は？　仕事を請負う余裕はあるか？
ならば、リトルアラミゴまで警護を依頼したい。","あちらの部隊に、アマルジャ族について報告がある。
戦況に関わる重大な情報だが、
それを知る際、うかつにもやつらに顔を見られたのだ。","襲撃に備えようにも、この部隊が集団で動けば
かえって標的になるだろう。
そこで、外から来たお前に警護を頼みたい。","手を貸しますか？

<UIForeground>F201F4</UIForeground><UIGlow>F201F5</UIGlow>※このF.A.T.E.の推奨レベルは<Value>IntegerParameter(1)</Value>です。<UIGlow>01</UIGlow><UIForeground>01</UIForeground>","","","では、今の話は忘れるように。一切の他言は無用だ。",""
39,2,2,2,2,2,2,2,2,0,0,0,0,0,0,0,0,1,1,1,1,1,1,1,1,0,0,0,0,0,0,0,0,0,0,0,0,0,0,0,0,False,False,False,False,False,False,False,False,0,0,0,3,0,0,0,0,"なぁ、あんた、冒険者だろ？
あんたの力を借りたいんだ。","このあたりにはオーシャン・ローズリングっていう
花の魔物が繁茂しててな……参っちまうよ。
完全に根付いてるのか、刈っても刈っても現れちまう。","かといって、放置もできないんだが……
いい加減、俺たちもいっぱいいっぱいでなぁ。
よければ、奴らの駆除に手を貸してくれないか？","駆除に手を貸しますか？

<UIForeground>F201F4</UIForeground><UIGlow>F201F5</UIGlow>※このF.A.T.E.の推奨レベルは<Value>IntegerParameter(1)</Value>です。<UIGlow>01</UIGlow><UIForeground>01</UIForeground>","そうかそうか、手伝ってくれるのか！
助かるよ……と、言ってるそばから姿を見せたな！
さあ冒険者さん、さっそくやっちゃってくれ！！","","ん……そうか、手伝えないか。
まぁ、無理強いもできないからな。
また今度、手の空いてる時に手伝ってくれればいいさ。",""
40,2,2,2,2,2,2,2,2,0,0,0,0,0,0,0,0,1,1,1,1,1,1,1,1,0,0,0,0,0,0,0,0,0,0,0,0,0,0,0,0,False,False,False,False,False,False,False,False,0,0,0,0,0,0,0,0,"オーシャン・ローズリングめ、どんどん出てきてるな！
よし、冒険者さん、片っ端からやっつけちまってくれ！
頼りにしてるからなっ！","","","","","","",""
41,2,2,2,2,2,2,2,2,0,0,0,0,0,0,0,0,1,1,1,1,1,1,1,1,0,0,0,0,0,0,0,0,0,0,0,0,0,0,0,0,False,False,False,False,False,False,False,False,0,0,0,3,0,0,0,0,"助けて、冒険者の人！
私一人じゃどうにもならないのよ！","風車小屋で挽いた小麦粉を出荷したいんだけど、
お腹を空かせたガラゴが狙ってくるから運べないの。","味を覚えちゃったみたいで、運んでると襲ってくるのよ。
お願い、ガラゴたちをやっつけて！","退治を引き受けますか？

<UIForeground>F201F4</UIForeground><UIGlow>F201F5</UIGlow>※このF.A.T.E.の推奨レベルは<Value>IntegerParameter(1)</Value>です。<UIGlow>01</UIGlow><UIForeground>01</UIForeground>","ありがとう、やっぱり冒険者さんは頼りになるわね。
じゃあ、よろしくお願いね！","","ああ、そう……じゃあ仕方ないわね。
残念だけど、他の人を探して頼むことにするわ。",""
42,2,2,2,2,2,2,2,2,0,0,0,0,0,0,0,0,1,1,1,1,1,1,1,1,0,0,0,0,0,0,0,0,0,0,0,0,0,0,0,0,False,False,False,False,False,False,False,False,0,0,0,0,0,0,0,0,"このあたりではリバートードが繁殖しやすくてね、
定期的に駆除しないと、大変なことになっちまうんだよ。
今はちょうど、その定期駆除の真っ最中ってわけさ。","慣れているとはいえ、楽な作業じゃなくてね。
よかったら、あんたも手伝ってくれないか？","駆除対象は、リバートードの中でもとくに繁殖力の高い
ケーントードと呼ばれている個体だ。
通常の個体は、放っておいて構わない。","それじゃあ頼むぞ、冒険者。
俺はここで街道を通る人が巻き込まれないよう、
見張っていることにする。","……別に、トードが苦手な訳じゃないんだからな？","","",""
43,2,2,2,2,2,2,2,2,0,0,0,0,0,0,0,0,1,1,1,1,1,1,1,1,0,0,0,0,0,0,0,0,0,0,0,0,0,0,0,0,False,False,False,False,False,False,False,False,0,0,3,0,0,0,0,0,"このあたりではリバートードが繁殖しやすくてね、
定期的に駆除しないと、大変なことになっちまうんだよ。
今からちょうど、その定期駆除をやろうと思ってる。","慣れているとはいえ、楽な作業じゃなくてね。
よかったら、あんたも手伝ってくれないか？","駆除を手伝いますか？

<UIForeground>F201F4</UIForeground><UIGlow>F201F5</UIGlow>※このF.A.T.E.の推奨レベルは<Value>IntegerParameter(1)</Value>です。<UIGlow>01</UIGlow><UIForeground>01</UIForeground>","","駆除対象は、リバートードの中でもとくに繁殖力の高い
ビートトードと呼ばれている個体だ。
通常の個体は、放っておいて構わない。","","そうか……じゃあ、しょうがないな
我々だけで対処するとしよう。",""
44,2,2,2,2,2,2,2,2,0,0,0,0,0,0,0,0,1,1,1,1,1,1,1,1,0,0,0,0,0,0,0,0,0,0,0,0,0,0,0,0,False,False,False,False,False,False,False,False,0,0,3,0,0,0,0,0,"参ったな……またヤーゾンが集まってきやがった。
やつら、杭打ち機に巣を作ろうとするんだよ。","こうなると作業になんなくてね。
すまないが、ヤーゾンの駆除を手伝ってくれないか？","引き受けますか？

<UIForeground>F201F4</UIForeground><UIGlow>F201F5</UIGlow>※このF.A.T.E.の推奨レベルは<Value>IntegerParameter(1)</Value>です。<UIGlow>01</UIGlow><UIForeground>01</UIForeground>","","助かるよ。
やつら、そこの木の辺りに集まってきてる。
杭打ち機に寄り付く前に、倒してくれ！","","そうか……。急いで他を当たらないとな。",""
45,2,2,2,2,2,2,2,2,0,0,0,0,0,0,0,0,1,1,1,1,1,1,1,1,0,0,0,0,0,0,0,0,0,0,0,0,0,0,0,0,False,False,False,False,False,False,False,False,0,0,3,0,0,0,0,0,"今、この辺りでアーススプライトが大量発生している……。
やつらの核を集めてくれないか……。","あれを地面に打ち込めば、地盤強化になる……。
ザナラーン開拓の……必需品だ。","手を貸しますか？

<UIForeground>F201F4</UIForeground><UIGlow>F201F5</UIGlow>※このF.A.T.E.の推奨レベルは<Value>IntegerParameter(1)</Value>です。<UIGlow>01</UIGlow><UIForeground>01</UIForeground>","","核は倒して奪ってもいいし、拾ってきてもいい……。
とにかく集めて、持ってきてくれ……。","","お前には、関係のないことだったな……。",""
46,2,2,2,2,2,2,2,2,0,0,0,0,0,0,0,0,1,1,1,1,1,1,1,1,0,0,0,0,0,0,0,0,0,0,0,0,0,0,0,0,False,False,False,False,False,False,False,False,0,0,3,0,0,0,0,0,"お、お助けくだせぇ冒険者様！
そこの廃屋を根城にしている盗賊団に、
大事な荷を奪われちまった……！","あの荷がなけりゃ飢えて死ぬだけ、
根城に乗り込みゃ犬死にだ。
どうか、あっしの荷物を取り戻してくだせぇ！","手を貸しますか？

<UIForeground>F201F4</UIForeground><UIGlow>F201F5</UIGlow>※このF.A.T.E.の推奨レベルは<Value>IntegerParameter(1)</Value>です。<UIGlow>01</UIGlow><UIForeground>01</UIForeground>","","神様！　あっしの命、冒険者様に託しましたぜ！","","そんなぁ～！
このままアリの餌にでもなれってんですかい！？",""
