145,2,2,2,2,2,2,2,2,0,0,0,0,0,0,0,0,1,1,1,1,1,1,1,1,0,0,0,0,0,0,0,0,0,0,0,0,0,0,0,0,False,False,False,False,False,False,False,False,0,0,0,3,0,0,0,0,"実はギガースがこの地を狙ってましてね～。
何度か追い返したりしてたんですが、
今度はここへの物資を狙いだしたんですよ～。","運悪く、この物資を輸送中に我々も襲われまして～。
なんとかここまでたどり着きましたが
物資を狙ってまた襲ってくるんだろうな～と。","護衛の彼らも、道中の戦闘で疲労してましてね～。
誰かなんとかしてくれないかな～、なんて。","手を貸しますか？

<UIForeground>F201F4</UIForeground><UIGlow>F201F5</UIGlow>※このF.A.T.E.の推奨レベルは<Value>IntegerParameter(1)</Value>です。<UIGlow>01</UIGlow><UIForeground>01</UIForeground>","","","ですよね～。
そんな奇特な方そうそういるもんじゃ
ないですよね～。",""
146,0,0,0,0,0,0,0,0,0,0,0,0,0,0,0,0,1,1,1,1,1,1,1,1,0,0,0,0,0,0,0,0,0,0,0,0,0,0,0,0,False,False,False,False,False,False,False,False,0,0,0,0,0,0,0,0,"イシュガルドにおいて、この「聖ダナフェンの落涙」は、
「聖水」の湧く聖なる泉として知られています。","私も「聖水」を求めてやってきたのですが、
突然、危険なウォータースプライトが沸いてしまって……
どうか私の代わりに、「聖水」を集めてくれませんか？","","","","","",""
147,0,0,0,0,0,0,0,0,0,0,0,0,0,0,0,0,1,1,1,1,1,1,1,1,0,0,0,0,0,0,0,0,0,0,0,0,0,0,0,0,False,False,False,False,False,False,False,False,0,2,0,0,0,0,0,0,"あの、「聖水」を持ってきてくれたのでしょうか？","","","","そ……そうです、これです！
ああ、これがもっとあれば、助かるのですが……。","","そうですか……あの、冒険者の方？
もしかして、あなたも「聖水」を求めて、
ここまでいらっしゃったとかなのでしょうか？",""
148,0,0,0,0,0,0,0,0,0,0,0,0,0,0,0,0,1,1,1,1,1,1,1,1,0,0,0,0,0,0,0,0,0,0,0,0,0,0,0,0,False,False,False,False,False,False,False,False,0,0,0,0,0,0,0,0,"これだけあれば、式典で注文された量には事足ります。
とはいえ、予備もいくらかは必要ですので……
まだ「聖水」をお持ちなら、ぜひ私にお譲りください。
","","","","","","",""
149,0,0,0,0,0,0,0,0,0,0,0,0,0,0,0,0,1,1,1,1,1,1,1,1,0,0,0,0,0,0,0,0,0,0,0,0,0,0,0,0,False,False,False,False,False,False,False,False,0,2,0,0,0,0,0,0,"すでに「聖水」は必要量集まったのですが、
何があるかわかりませんし、余分に用意したいのです。
まだ「聖水」をお持ちでしたら、いただきますよ？","","","","ありがとうございます。
あなたは、かような善行を為される方です。
必ずや神のご加護がありますよ。","","そうですか……。
あの、もしかして……あなたご自身も、
式典に「聖水」を持っていかれるおつもりなのですか？",""
150,2,2,2,2,2,2,2,2,0,0,0,0,0,0,0,0,1,1,1,1,1,1,1,1,0,0,0,0,0,0,0,0,0,0,0,0,0,0,0,0,False,False,False,False,False,False,False,False,0,0,0,3,0,0,0,0,"そこの冒険者の人、力を貸してもらえないかな？
自分、ここの青燐精製所の技師なんだけど……
あんたみたいな冒険者サンに、頼みたいことあんのさ。","ここでやってる青燐水の精製には触媒として、
「アーススプライトの核」を使用しているんだけどね……
あいにく、うっかりと在庫を切らしちゃった。","それで周辺の「アーススプライト」から調達できんかと、
思ってみたりもしたんだが……自分、戦闘はからっきしで。
冒険者サン、自分の代わりに集めてくれないかな？","力を貸しますか？

<UIForeground>F201F4</UIForeground><UIGlow>F201F5</UIGlow>※このF.A.T.E.の推奨レベルは<Value>IntegerParameter(1)</Value>です。<UIGlow>01</UIGlow><UIForeground>01</UIForeground>","力を貸してくれるんかい！？
いやぁ、助かる助かる、あーりがとぉー！
「アーススプライトの核」、よろしく頼むよ！","","んむっ……そっかぁ、わかった。
無理には頼まないよ、他の人を当たってみるさ。",""
151,2,2,2,2,2,2,2,2,0,0,0,0,0,0,0,0,1,1,1,1,1,1,1,1,0,0,0,0,0,0,0,0,0,0,0,0,0,0,0,0,False,False,False,False,False,False,False,False,0,0,0,0,0,0,0,0,"頼んだのは「アーススプライトの核」だ。
青燐水を精製するとき、触媒に使うシロモノでね。
よろしく頼むよ、冒険者サン。","「アーススプライトの核」は、
近くにいる「アーススプライト」を倒しても手に入るし、
落ちてるのを集めてくれてもいい、どっちも一緒のもんだ。","ともかく、数がいるんだよ。
たっくさん頼むぜ。","","","","",""
152,2,2,2,2,2,2,2,2,0,0,0,0,0,0,0,0,1,1,1,1,1,1,1,1,0,0,0,0,0,0,0,0,0,0,0,0,0,0,0,0,False,False,False,False,False,False,False,False,0,2,0,0,0,0,0,0,"どうしたい冒険者サン、
「アーススプライトの核」を持ってきてくれたんかい？","","","","そうそう、これだよこれ！
この「アーススプライトの核」が必要だったのさ。
んじゃ、まだまだ要るんで、どんどん持ってきてくれな！","","いいかい冒険者サン、「アーススプライトの核」だ。
こいつを自分のところまで、バンバン持ってきてくれっ！",""
153,1,1,1,1,1,1,1,1,0,0,0,0,0,0,0,0,1,1,1,1,1,1,1,1,0,0,0,0,0,0,0,0,0,0,0,0,0,0,0,0,False,False,False,False,False,False,False,False,0,0,0,3,0,0,0,0,"そこの冒険者さん。
もしかして「キャンプ・ドラゴンヘッド」まで
向かうとかだったりしませんか？","実は北の「キャンプ・ドラゴンヘッド」まで
星読みの結果を至急伝える必要がありまして……。
星読みの結果ですか？それは極秘事項で……。","普段であればお付きのものが同行してくれるのですが、
急なことでみな出払っていて…。
道中私の身をお守り頂けないでしょうか。","護衛してあげますか？

<UIForeground>F201F4</UIForeground><UIGlow>F201F5</UIGlow>※このF.A.T.E.の推奨レベルは<Value>IntegerParameter(1)</Value>です。<UIGlow>01</UIGlow><UIForeground>01</UIForeground>","","","分かりました。
残念ですが仕方ありません。
どうしよう、早く伝えないと……。",""
154,2,2,2,2,2,2,2,2,0,0,0,0,0,0,0,0,1,1,1,1,1,1,1,1,0,0,0,0,0,0,0,0,0,0,0,0,0,0,0,0,False,False,False,False,False,False,False,False,0,0,0,3,0,0,0,0,"おお、この運命の出会いに感謝します。
つり橋におびえて逃げ出したこの子を追いかけて、
そのまま道に迷ってしまいました。","商隊と合流したいのですが
この子が、魔物の気配にすっかり怖じ気付いて
動いてくれないのです。","この子が、動き出すまで、
しばらくそばにいてくれないか？","いてあげますか？

<UIForeground>F201F4</UIForeground><UIGlow>F201F5</UIGlow>※このF.A.T.E.の推奨レベルは<Value>IntegerParameter(1)</Value>です。<UIGlow>01</UIGlow><UIForeground>01</UIForeground>","おお、あなたをつかわされた運命の神に感謝を！","","おお、運命の出会いではなかったのですね……。",""
155,2,2,2,2,2,2,2,2,0,0,0,0,0,0,0,0,1,1,1,1,1,1,1,1,0,0,0,0,0,0,0,0,0,0,0,0,0,0,0,0,False,False,False,False,False,False,False,False,0,0,0,3,0,0,0,0,"ジジルン、タマゴ、スキスキっちゃ！
キキルンみんな、タマゴ、スキスキっちゃ！","ジジルン、タマゴ、ないないっちゃ！
ジジルン、タマゴ、あつめるっちゃ！","あっちに、ペリカン、いるいるっちゃ。
あなた、「ペリカンの卵」、とるとるっちゃ！","「ペリカンの卵」をとってきてあげますか？

<UIForeground>F201F4</UIForeground><UIGlow>F201F5</UIGlow>※このF.A.T.E.の推奨レベルは<Value>IntegerParameter(1)</Value>です。<UIGlow>01</UIGlow><UIForeground>01</UIForeground>","ジジルン、わくわくっちゃ……
タマゴ、わくわくっちゃ……","","ジジルン、しょんぼりっちゃ……
タマゴ、たべたいっちゃ……",""
156,2,2,2,2,2,2,2,2,0,0,0,0,0,0,0,0,1,1,1,1,1,1,1,1,0,0,0,0,0,0,0,0,0,0,0,0,0,0,0,0,False,False,False,False,False,False,False,False,0,2,0,0,0,0,0,0,"「ペリカンの卵」、あるあるっちゃ？","","","","ジジルン、うきうきっちゃ。
もっともっと、くれくれっちゃ！","","「ペリカンの卵」、もっともっと、くれくれっちゃ！",""
157,2,2,2,2,2,2,2,2,0,0,0,0,0,0,0,0,1,1,1,1,1,1,1,1,0,0,0,0,0,0,0,0,0,0,0,0,0,0,0,0,False,False,False,False,False,False,False,False,0,0,0,0,0,0,0,0,"「ペリカンの卵」、くれくれっちゃ！","","","","","","",""
158,2,2,2,2,2,2,2,2,0,0,0,0,0,0,0,0,1,1,1,1,1,1,1,1,0,0,0,0,0,0,0,0,0,0,0,0,0,0,0,0,False,False,False,False,False,False,False,False,0,0,0,0,0,0,0,0,"「ペリカンの卵」、もりもりっちゃ！
これで、ちゃりちゃり、もりもりっちゃ！","","","","","","",""
159,2,2,2,2,2,2,2,2,0,0,0,0,0,0,0,0,1,1,1,1,1,1,1,1,0,0,0,0,0,0,0,0,0,0,0,0,0,0,0,0,False,False,False,False,False,False,False,False,0,2,0,0,0,0,0,0,"「ペリカンの卵」、もりもり、うれしいっちゃ！
もっともりもり、ほしいっちゃ！","","","","ジジルン、ルンルンっちゃ。
もっともりもり、くれくれっちゃ！","","ジジルン、ワクワクっちゃ。
タマゴ、もりもり、ワクワクっちゃ！",""
160,2,2,2,2,2,2,2,2,0,0,0,0,0,0,0,0,1,1,1,1,1,1,1,1,0,0,0,0,0,0,0,0,0,0,0,0,0,0,0,0,False,False,False,False,False,False,False,False,0,0,0,3,0,0,0,0,"ああっ、助けて冒険者さんっ！
お願いします、他に頼れる人いないんですぅっ！","森で働いていたら、「リンドヴルム」に襲われたんです！
慌てて、何とかここまで逃げてきたんですけど……
しつこくて、まだ追うのを諦めてません！","お願いします、冒険者さん！
あの恐ろしい「リンドヴルム」を退治してください！","退治しますか？

<UIForeground>F201F4</UIForeground><UIGlow>F201F5</UIGlow>※このF.A.T.E.の推奨レベルは<Value>IntegerParameter(1)</Value>です。<UIGlow>01</UIGlow><UIForeground>01</UIForeground>","","","そ、そんな……。
こんな残酷なことがあっていいの……！？",""
161,2,2,2,2,2,2,2,2,0,0,0,0,0,0,0,0,1,1,1,1,1,1,1,1,0,0,0,0,0,0,0,0,0,0,0,0,0,0,0,0,False,False,False,False,False,False,False,False,0,0,0,3,0,0,0,0,"あなた、誰でふっち？
もちかちて、手伝ってくれるのでふっち？","ここでなかまがたくさん死んでた、悲ちい場所でふっち。
ここには、たいせつななかまのもちものが落ちてるふっち。
なかまのもちもの、集めてあげたいでふっち。","お願いでふっち、
なかまの思いでの持ち物、あつめてほちいんでふっち！","シルフの遺品を集めますか？

<UIForeground>F201F4</UIForeground><UIGlow>F201F5</UIGlow>※このF.A.T.E.の推奨レベルは<Value>IntegerParameter(1)</Value>です。<UIGlow>01</UIGlow><UIForeground>01</UIForeground>","ありがとふっち、助かるふっち。
でも、わるいシルフもきてるふっち。
気をつけるでふっち。","","ううっ、ちもなみだもないでふっち。
あなたなんかキライでふっち、かえれかえれでふっち！",""
162,2,2,2,2,2,2,2,2,0,0,0,0,0,0,0,0,1,1,1,1,1,1,1,1,0,0,0,0,0,0,0,0,0,0,0,0,0,0,0,0,False,False,False,False,False,False,False,False,0,2,0,0,0,0,0,0,"なかまのもちもの、持ってきたでふっち？","","","","ありがとふっち。
もっとお願いするでふっち。","","ものがないでふっち？",""
163,2,2,2,2,2,2,2,2,0,0,0,0,0,0,0,0,1,1,1,1,1,1,1,1,0,0,0,0,0,0,0,0,0,0,0,0,0,0,0,0,False,False,False,False,False,False,False,False,0,0,0,0,0,0,0,0,"なかまのもの、集めてるでふっち。
見つけたら持ってくるでふっち。","","","","","","",""
164,2,2,2,2,2,2,2,2,0,0,0,0,0,0,0,0,1,1,1,1,1,1,1,1,0,0,0,0,0,0,0,0,0,0,0,0,0,0,0,0,False,False,False,False,False,False,False,False,0,0,0,0,0,0,0,0,"いっぱい集まって、うれちいでふっち。
でも、もっとあったら、ほしいでふっち。","","","","","","",""
165,2,2,2,2,2,2,2,2,0,0,0,0,0,0,0,0,1,1,1,1,1,1,1,1,0,0,0,0,0,0,0,0,0,0,0,0,0,0,0,0,False,False,False,False,False,False,False,False,0,2,0,0,0,0,0,0,"まだあるのでふっち？
あるなら、もらってあげたいでふっち。","","","","ありがとふっち。
たくさんたくさん、あるほうがいいふっち。","","そうでふっち？
ないなら、なくてもいいでふっち。",""
166,2,2,2,2,2,2,2,2,0,0,0,0,0,0,0,0,1,1,1,1,1,1,1,1,0,0,0,0,0,0,0,0,0,0,0,0,0,0,0,0,False,False,False,False,False,False,False,False,0,0,0,3,0,0,0,0,"ん、何を揉めてるかって？
実は彼、ここを出禁になっててねぇ。
お引き取り願おうとしているのさ。","マムージャ族の湯浴みの踊りが卑猥だと、
ほかの客から苦情が殺到してるもんで、
やめるよう頼んでるんだが、聞いてくれなくてね……。","もはや、腕ずくで止めるしかない状況さ。
よければ、あんたも手を貸してくれないか？","手を貸しますか？

<UIForeground>F201F4</UIForeground><UIGlow>F201F5</UIGlow>※このF.A.T.E.の推奨レベルは<Value>IntegerParameter(1)</Value>です。<UIGlow>01</UIGlow><UIForeground>01</UIForeground>","","","そうか……
マムージャ族は、うでっぷしが強いから
不安だが、自分でやるしかないか……",""
167,1,1,1,1,1,1,1,1,0,0,0,0,0,0,0,0,1,1,1,1,1,1,1,1,0,0,0,0,0,0,0,0,0,0,0,0,0,0,0,0,False,False,False,False,False,False,False,False,0,0,0,3,0,0,0,0,"ちょいとそこ行く冒険者の人！
あたしの話を聞いちゃくれませんかね？","実はこれから青燐精製所まで、
商談をまとめに赴かなければならないんですが……。","最近イロイロと物騒でしょ？
ひとりで行くのが不安だから、ご一緒してもらえないか、
なーんて思いまして……どうでしょうかね？","一緒に行きますか？

<UIForeground>F201F4</UIForeground><UIGlow>F201F5</UIGlow>※このF.A.T.E.の推奨レベルは<Value>IntegerParameter(1)</Value>です。<UIGlow>01</UIGlow><UIForeground>01</UIForeground>","","","なんだ、冷やかしですか。
だったら……帰ってくれませんかね？",""
168,2,2,2,2,2,2,2,2,0,0,0,0,0,0,0,0,1,1,1,1,1,1,1,1,0,0,0,0,0,0,0,0,0,0,0,0,0,0,0,0,False,False,False,False,False,False,False,False,0,0,0,3,0,0,0,0,"冒険者さん、力を貸してください！
この地で蛮神イフリートのテンパードたちが、
蛮神を崇め奉る儀式をしようとしているようなんです！","これ以上、蛮神イフリートに力をつけられては、
我らが不滅隊にとってよい結果は生まれないでしょう……。","奴らが儀式に使っている祭器があるはずです。
儀式を仕切るアマルジャ族の祭司・警備兵ともども、
この地より排除してはもらえないでしょうか！？","手を貸しますか？

<UIForeground>F201F4</UIForeground><UIGlow>F201F5</UIGlow>※このF.A.T.E.の推奨レベルは<Value>IntegerParameter(1)</Value>です。<UIGlow>01</UIGlow><UIForeground>01</UIForeground>","","","そうですか……申し訳ない、無理を言いました。
確かに、これだけの敵を相手することは簡単ではない……
勝算なき戦を、軽々にできるはずありませんよね。",""
169,2,2,2,2,2,2,2,2,0,0,0,0,0,0,0,0,1,1,1,1,1,1,1,1,0,0,0,0,0,0,0,0,0,0,0,0,0,0,0,0,False,False,False,False,False,False,False,False,0,0,0,0,0,0,0,0,"アマルジャ族のテンパードたちが行っている、
蛮神イフリートを崇め奉る儀式を止めてください！","儀式を取り仕切っている、
アマルジャ族の祭司と警備兵を倒すんです。
そうすれば、奴らの祭器が見つかるはず……！","周りのテンパードたちの抵抗もあるでしょうが、
全てをこの地より排除してください！
くれぐれも、お気をつけて！","","","","",""
170,0,0,0,0,0,0,0,0,0,0,0,0,0,0,0,0,1,1,1,1,1,1,1,1,0,0,0,0,0,0,0,0,0,0,0,0,0,0,0,0,False,False,False,False,False,False,False,False,0,0,0,3,0,0,0,0,"おお、なんてたくましそうな冒険者さんだ。
ひとつ、その素敵な腕を貸してくれませんか？","荷馬車が、積荷のワインを落としているのに気づかず
さっさと行ってしまったんです。","上等なワインですので、拾い集めて、
ワインポートへ運びたいんですが……
私の細腕じゃ、とてもとても運べそうにないもので……","運んであげますか？

<UIForeground>F201F4</UIForeground><UIGlow>F201F5</UIGlow>※このF.A.T.E.の推奨レベルは<Value>IntegerParameter(1)</Value>です。<UIGlow>01</UIGlow><UIForeground>01</UIForeground>","","","そ、そんな……。
こんなことなら、普段から鍛えておけばよかった……。",""
171,2,2,2,2,2,2,2,2,0,0,0,0,0,0,0,0,1,1,1,1,1,1,1,1,0,0,0,0,0,0,0,0,0,0,0,0,0,0,0,0,False,False,False,False,False,False,False,False,0,0,0,0,0,0,0,0,"いやぁ、助かるよ！
冒険者サンのおかげで、いっぱい集まったさ。","だが、出し惜しみはやめといてくれるかな？
まだ持ってるなら受け取るから、自分によこしてくれよ。","","","","","",""
172,2,2,2,2,2,2,2,2,0,0,0,0,0,0,0,0,1,1,1,1,1,1,1,1,0,0,0,0,0,0,0,0,0,0,0,0,0,0,0,0,False,False,False,False,False,False,False,False,0,2,0,0,0,0,0,0,"おっと……もしかして冒険者サン、
「アーススプライトの核」を持ってきてくれたのかい？","","","","そうだよ、これさ！　これが欲しかったのさ！
もっともっと、持ってきてくれよな！","","まだあるのかい？
あるなら、早めに持ってきてくれよ。
俺がこの場を去ってしまう前にさ。",""
173,1,1,1,1,1,1,1,1,0,0,0,0,0,0,0,0,1,1,1,1,1,1,1,1,0,0,0,0,0,0,0,0,0,0,0,0,0,0,0,0,False,False,False,False,False,False,False,False,0,0,0,3,0,0,0,0,"シーッ！
今は偵察任務中だ、大きな声を出すなよ冒険者……。
ここがバレたら、命はないぜ……？","いいか、ここには帝国の先遣部隊がいる。
奴らめ、どうやってここまで入ってきたかしらんが……
何を企んでるか、ここでこうして探っているのさ。","……だが、ここに近々テンパードシルフがくるらしいんだ。
あいつらが、帝国兵とぶつかったら大騒ぎになる……。
先に帝国兵を撃破して、全面対決を避けるんだ！","協力しますか？

<UIForeground>F201F4</UIForeground><UIGlow>F201F5</UIGlow>※このF.A.T.E.の推奨レベルは<Value>IntegerParameter(1)</Value>です。<UIGlow>01</UIGlow><UIForeground>01</UIForeground>","やってくれるか！
すまない、恩に着るぜ……。","","そうか……さすがに、ひとりで突撃はできねぇ。
もう少し両者の様子を探って、戦力を把握しておくか……。",""
174,1,1,1,1,1,1,1,1,0,0,0,0,0,0,0,0,1,1,1,1,1,1,1,1,0,0,0,0,0,0,0,0,0,0,0,0,0,0,0,0,False,False,False,False,False,False,False,False,0,0,0,3,0,0,0,0,"おお、頼れそうな冒険者よ、いいところに。
このコボルド軍試掘地に動きアリとの
情報を得て、偵察に来たのですが……","確かに試掘作業が開始されているようです。
奴らが、まだこちらに気づいていない今なら、
奇襲をしかけることで、試掘を妨害できるはず！","よければ、
「コボルド族の採掘道具」の破壊にご協力ください。
黒渦団にあなたの名を売る、いい機会にもなりますよ。","協力しますか？

<UIForeground>F201F4</UIForeground><UIGlow>F201F5</UIGlow>※このF.A.T.E.の推奨レベルは<Value>IntegerParameter(1)</Value>です。<UIGlow>01</UIGlow><UIForeground>01</UIForeground>","","","手柄をあげる好機をみすみす逃すとは……。",""
175,2,2,2,2,2,2,2,2,0,0,0,0,0,0,0,0,1,1,1,1,1,1,1,1,0,0,0,0,0,0,0,0,0,0,0,0,0,0,0,0,False,False,False,False,False,False,False,False,0,0,0,3,0,0,0,0,"お願いします、助けてください！
娘とここを歩いていたら、「最後の群民」の信者が、
突然襲いかかってきて、娘を連れ去っていったのです！！","奴らは娘を抱え、この奥へ消えていきました。
ああ、このままでは娘が
「救世神ダラガブ」の生贄にされてしまう！！","慈悲深く、勇気あふれる冒険者さん、お願いです！
どうか「最後の群民」から、娘を助け出してください！","助けてあげますか？

<UIForeground>F201F4</UIForeground><UIGlow>F201F5</UIGlow>※このF.A.T.E.の推奨レベルは<Value>IntegerParameter(1)</Value>です。<UIGlow>01</UIGlow><UIForeground>01</UIForeground>","ありがとうございます！
娘はこの奥にいるはずです！
","","そんな……
どうしたら……。
",""
176,2,2,2,2,2,2,2,2,0,0,0,0,0,0,0,0,1,1,1,1,1,1,1,1,0,0,0,0,0,0,0,0,0,0,0,0,0,0,0,0,False,False,False,False,False,False,False,False,0,0,0,0,0,0,0,0,"「最後の群民」から、娘を助け出してください！
娘はこの奥にいるはずです！","","","","","","",""
177,1,1,1,1,1,1,1,1,0,0,0,0,0,0,0,0,1,1,1,1,1,1,1,1,0,0,0,0,0,0,0,0,0,0,0,0,0,0,0,0,False,False,False,False,False,False,False,False,0,0,0,0,0,0,0,0,"お願いです、お助けください！
「最後の群民」にさらわれたんです。","","","","","","",""
178,1,1,1,1,1,1,1,1,0,0,0,0,0,0,0,0,1,1,1,1,1,1,1,1,0,0,0,0,0,0,0,0,0,0,0,0,0,0,0,0,False,False,False,False,False,False,False,False,0,0,0,3,0,0,0,0,"ご親切にありがとうございます！
神様は、まだ私を見捨ててはいなかったのですね！","「最後の群民」は、私を生贄にささげるために
無理やりここへ連れてきました。
奴らを倒さないかぎり、同じことが繰り返されるでしょう。","ですから、親切な冒険者さん、
奴らを倒してくださいませんか？
奴らは、また儀式をするためにやってくるはずなんです。","「最後の群民」と戦いますか？

<UIForeground>F201F4</UIForeground><UIGlow>F201F5</UIGlow>※このF.A.T.E.の推奨レベルは<Value>IntegerParameter(1)</Value>です。<UIGlow>01</UIGlow><UIForeground>01</UIForeground>","","","そうですか……残念です。",""
179,0,0,0,0,0,0,0,0,0,0,0,0,0,0,0,0,1,1,1,1,1,1,1,1,0,0,0,0,0,0,0,0,0,0,0,0,0,0,0,0,False,False,False,False,False,False,False,False,0,0,0,0,0,0,0,0,"さあ、おとなしく生贄となるがいい！","","","","","","",""
180,0,0,0,0,0,0,0,0,0,0,0,0,0,0,0,0,0,0,0,0,0,0,0,0,0,0,0,0,0,0,0,0,0,0,0,0,0,0,0,0,False,False,False,False,False,False,False,False,0,0,0,0,0,0,0,0,"……。","","","","","","",""
181,1,1,1,1,1,1,1,1,0,0,0,0,0,0,0,0,1,1,1,1,1,1,1,1,0,0,0,0,0,0,0,0,0,0,0,0,0,0,0,0,False,False,False,False,False,False,False,False,0,0,0,3,0,0,0,0,"キャンプ・オーバールックへ物資を輸送中なのだが、
荷運びチョコボが怪我しちまってな……。
どうにも動けず、立ち往生しているのだ。","この辺りは、コボルド族が多いから、
チョコボから目を離せず、助けも呼びに行けなくてな。","ここは、荷車を押してくしかねえな……
よければ、あんた、手伝ってくれないか？","手伝ってあげますか？

<UIForeground>F201F4</UIForeground><UIGlow>F201F5</UIGlow>※このF.A.T.E.の推奨レベルは<Value>IntegerParameter(1)</Value>です。<UIGlow>01</UIGlow><UIForeground>01</UIForeground>","","","あんたの顔は、忘れないぜ……。",""
182,2,2,2,2,2,2,2,2,0,0,0,0,0,0,0,0,1,1,1,1,1,1,1,1,0,0,0,0,0,0,0,0,0,0,0,0,0,0,0,0,False,False,False,False,False,False,False,False,0,0,0,3,0,0,0,0,"おい……そこな道行く冒険者よ。
お前、腕っ節に自信はあるか？
もしもあるならその腕前、披露してみる気はないか？","実は今、ここザンラク脇本陣に
「金剛のネゼド・ガー」が来ているのだ。
奴は過去何度も、我が不滅隊の前に立ちはだかった強敵だ。","今なら奴と多少の雑魚が周りにいるのみよ。
誅殺するには千載一遇ともいえる、絶好の機会なのだ。
どうだ、刺客となる気はあるか？","襲撃しますか？

<UIForeground>F201F4</UIForeground><UIGlow>F201F5</UIGlow>※このF.A.T.E.の推奨レベルは<Value>IntegerParameter(1)</Value>です。<UIGlow>01</UIGlow><UIForeground>01</UIForeground>","","","そうか……腕前に自信がないなら仕方ない。
自身を過大評価しないのもまた、強くなるには必要だ。
強くなれ冒険者よ、その時にこそ、力を借りよう。",""
