289,1,1,1,1,1,1,1,1,0,0,0,0,0,0,0,0,1,1,1,1,1,1,1,1,0,0,0,0,0,0,0,0,0,0,0,0,0,0,0,0,False,False,False,False,False,False,False,False,0,2,0,0,0,0,0,0,"ウキー！？","","","","ウッキキー！","","……ウキー。",""
290,1,1,1,1,1,1,1,1,0,0,0,0,0,0,0,0,1,1,1,1,1,1,1,1,0,0,0,0,0,0,0,0,0,0,0,0,0,0,0,0,False,False,False,False,False,False,False,False,0,0,0,0,0,0,0,0,"多くの「降神餅」が集まったぜ！
けど、振る舞う餅は、多ければ多いほど良いもんだ！
よかったら、もっと回収してきてくれよな！？","","","","","","",""
291,1,1,1,1,1,1,1,1,0,0,0,0,0,0,0,0,1,1,1,1,1,1,1,1,0,0,0,0,0,0,0,0,0,0,0,0,0,0,0,0,False,False,False,False,False,False,False,False,0,2,0,0,0,0,0,0,"ウキキー！","","","","ウキキッキー！","","ウキー！　ウキッキー！",""
292,1,1,1,1,1,1,1,1,0,0,0,0,0,0,0,0,1,1,1,1,1,1,1,1,0,0,0,0,0,0,0,0,0,0,0,0,0,0,0,0,False,False,False,False,False,False,False,False,0,0,0,0,0,0,0,0,"ウキッ！","","","","","","",""
293,1,1,1,1,1,1,1,1,0,0,0,0,0,0,0,0,1,1,1,1,1,1,1,1,0,0,0,0,0,0,0,0,0,0,0,0,0,0,0,0,False,False,False,False,False,False,False,False,0,0,0,0,0,0,0,0,"キキー！","","","","","","",""
294,1,1,1,1,1,1,1,1,0,0,0,0,0,0,0,0,1,1,1,1,1,1,1,1,0,0,0,0,0,0,0,0,0,0,0,0,0,0,0,0,False,False,False,False,False,False,False,False,0,0,0,0,0,0,0,0,"サイクロプスに餅をつかせるまでは良かったんだが……。
狂犬一家を名乗る海賊が、軍用犬をけしかけてきて、
えれぇ騒ぎなんだ！","どうにかして「降神祭の臼」まで近づいて、
つきたての「降神餅」を回収してくれねぇか！？
持ってきた餅は「タロ」に渡してくれ！","","","","","",""
295,1,1,1,1,1,1,1,1,0,0,0,0,0,0,0,0,1,1,1,1,1,1,1,1,0,0,0,0,0,0,0,0,0,0,0,0,0,0,0,0,False,False,False,False,False,False,False,False,0,0,3,0,0,0,0,0,"サイクロプスに餅をつかせるまでは良かったんだが……。
狂犬一家を名乗る海賊が、軍用犬をけしかけてきて、
えれぇ騒ぎなんだ！","どうにかして「降神祭の臼」まで近づいて、
つきたての「降神餅」を回収してくれねぇか！？
持ってきた餅は「タロ」に渡してくれ！","手伝いますか？

<UIForeground>F201F4</UIForeground><UIGlow>F201F5</UIGlow>※このF.A.T.E.の推奨レベルは<Value>IntegerParameter(1)</Value>です。<UIGlow>01</UIGlow><UIForeground>01</UIForeground>","","","","そ、そうか……。
確かにあの「軍用犬」の大群を見たら、
尻込みするのも無理はねぇよな……。",""
296,1,1,1,1,1,1,1,1,0,0,0,0,0,0,0,0,1,1,1,1,1,1,1,1,0,0,0,0,0,0,0,0,0,0,0,0,0,0,0,0,False,False,False,False,False,False,False,False,0,2,0,0,0,0,0,0,"わん、わん……。","","","","ワン！ワォーン！","","キュゥゥゥゥン……。",""
297,1,1,1,1,1,1,1,1,0,0,0,0,0,0,0,0,1,1,1,1,1,1,1,1,0,0,0,0,0,0,0,0,0,0,0,0,0,0,0,0,False,False,False,False,False,False,False,False,0,0,0,0,0,0,0,0,"多くの「降神餅」が集まったぜ！
けど、振る舞う餅は、多ければ多いほど良いもんだ！
よかったら、もっと回収してきてくれよな！？","","","","","","",""
298,1,1,1,1,1,1,1,1,0,0,0,0,0,0,0,0,1,1,1,1,1,1,1,1,0,0,0,0,0,0,0,0,0,0,0,0,0,0,0,0,False,False,False,False,False,False,False,False,0,2,0,0,0,0,0,0,"きゃん、きゃん♪","","","","ゥワンッ! ゥワンッ!","","きゃん、きゃん！",""
299,1,1,1,1,1,1,1,1,0,0,0,0,0,0,0,0,1,1,1,1,1,1,1,1,0,0,0,0,0,0,0,0,0,0,0,0,0,0,0,0,False,False,False,False,False,False,False,False,0,0,0,0,0,0,0,0,"くーん、くーん……。","","","","","","",""
300,1,1,1,1,1,1,1,1,0,0,0,0,0,0,0,0,1,1,1,1,1,1,1,1,0,0,0,0,0,0,0,0,0,0,0,0,0,0,0,0,False,False,False,False,False,False,False,False,0,0,0,0,0,0,0,0,"アンアンッ!","","","","","","",""
301,1,1,1,1,1,1,1,1,0,0,0,0,0,0,0,0,1,1,1,1,1,1,1,1,0,0,0,0,0,0,0,0,0,0,0,0,0,0,0,0,False,False,False,False,False,False,False,False,0,3,0,0,0,0,0,0,"私は、アインハルト家に仕える工兵です。
放属性ファイアシャードの収集に、
協力願えませんか？","手伝いますか？","","","","","……そうですか。
ご自身の探索計画もあるでしょうから、仕方ありません。
気が変わりましたら、お声がけ願います。",""
302,1,1,1,1,1,1,1,1,0,0,0,0,0,0,0,0,1,1,1,1,1,1,1,1,0,0,0,0,0,0,0,0,0,0,0,0,0,0,0,0,False,False,False,False,False,False,False,False,0,0,0,0,0,0,0,0,"地表に凝固した放属性ファイアシャードを採取するか、
ファイアスプライトを倒すことで、集めてください。","","","","","","",""
303,1,1,1,1,1,1,1,1,0,0,0,0,0,0,0,0,1,1,1,1,1,1,1,1,0,0,0,0,0,0,0,0,0,0,0,0,0,0,0,0,False,False,False,False,False,False,False,False,0,2,0,0,0,0,0,0,"放属性ファイアシャードを集められましたか？
よろしければ、回収させていただきます。","","","","ご協力に感謝します！
アインハルト家を代表してお礼申し上げます！","","この資源は、いくらあっても困りません。
また収集されましたら、お届けくださいね！",""
304,1,1,1,1,1,1,1,1,0,0,0,0,0,0,0,0,1,1,1,1,1,1,1,1,0,0,0,0,0,0,0,0,0,0,0,0,0,0,0,0,False,False,False,False,False,False,False,False,0,0,0,0,0,0,0,0,"放属性ファイアシャードは、
その名のとおり、属性の力を放つ作用があります。
ディアデム諸島の貴重な資源と言えるでしょう。","","","","","","",""
305,1,1,1,1,1,1,1,1,0,0,0,0,0,0,0,0,1,1,1,1,1,1,1,1,0,0,0,0,0,0,0,0,0,0,0,0,0,0,0,0,False,False,False,False,False,False,False,False,0,2,0,0,0,0,0,0,"放属性ファイアシャードをお持ちでしたら、
回収させていただきます。","","","","さらなるご協力に感謝します！","","この資源は、いくらあっても困りません。
また収集されましたら、お届けくださいね！",""
306,1,1,1,1,1,1,1,1,0,0,0,0,0,0,0,0,1,1,1,1,1,1,1,1,0,0,0,0,0,0,0,0,0,0,0,0,0,0,0,0,False,False,False,False,False,False,False,False,0,3,0,0,0,0,0,0,"私は、アインハルト家に仕える工兵です。
放属性ライトニングシャードの収集に、
協力願えませんか？","手伝いますか？","","","","","……そうですか。
ご自身の探索計画もあるでしょうから、仕方ありません。
気が変わりましたら、お声がけ願います。",""
307,1,1,1,1,1,1,1,1,0,0,0,0,0,0,0,0,1,1,1,1,1,1,1,1,0,0,0,0,0,0,0,0,0,0,0,0,0,0,0,0,False,False,False,False,False,False,False,False,0,0,0,0,0,0,0,0,"地表に凝固した放属性ライトニングシャードを採取するか、
ライトニングスプライトを倒すことで、集めてください。","","","","","","",""
308,1,1,1,1,1,1,1,1,0,0,0,0,0,0,0,0,1,1,1,1,1,1,1,1,0,0,0,0,0,0,0,0,0,0,0,0,0,0,0,0,False,False,False,False,False,False,False,False,0,2,0,0,0,0,0,0,"放属性ライトニングシャードを集められましたか？
よろしければ、回収させていただきます。","","","","ご協力に感謝します！
アインハルト家を代表してお礼申し上げます！","","この資源は、いくらあっても困りません。
また収集されましたら、お届けくださいね！",""
309,1,1,1,1,1,1,1,1,0,0,0,0,0,0,0,0,1,1,1,1,1,1,1,1,0,0,0,0,0,0,0,0,0,0,0,0,0,0,0,0,False,False,False,False,False,False,False,False,0,0,0,0,0,0,0,0,"放属性ライトニングシャードは、
その名のとおり、属性の力を放つ作用があります。
ディアデム諸島の貴重な資源と言えるでしょう。","","","","","","",""
310,1,1,1,1,1,1,1,1,0,0,0,0,0,0,0,0,1,1,1,1,1,1,1,1,0,0,0,0,0,0,0,0,0,0,0,0,0,0,0,0,False,False,False,False,False,False,False,False,0,2,0,0,0,0,0,0,"放属性ライトニングシャードをお持ちでしたら、
回収させていただきます。","","","","さらなるご協力に感謝します！","","この資源は、いくらあっても困りません。
また収集されましたら、お届けくださいね！",""
311,1,1,1,1,1,1,1,1,0,0,0,0,0,0,0,0,1,1,1,1,1,1,1,1,0,0,0,0,0,0,0,0,0,0,0,0,0,0,0,0,False,False,False,False,False,False,False,False,0,3,0,0,0,0,0,0,"私は、アインハルト家に仕える工兵です。
放属性アースシャードの収集に、
協力願えませんか？","手伝いますか？","","","","","……そうですか。
ご自身の探索計画もあるでしょうから、仕方ありません。
気が変わりましたら、お声がけ願います。",""
312,1,1,1,1,1,1,1,1,0,0,0,0,0,0,0,0,1,1,1,1,1,1,1,1,0,0,0,0,0,0,0,0,0,0,0,0,0,0,0,0,False,False,False,False,False,False,False,False,0,0,0,0,0,0,0,0,"地表に凝固した放属性アースシャードを採取するか、
アーススプライトを倒すことで、集めてください。","","","","","","",""
313,1,1,1,1,1,1,1,1,0,0,0,0,0,0,0,0,1,1,1,1,1,1,1,1,0,0,0,0,0,0,0,0,0,0,0,0,0,0,0,0,False,False,False,False,False,False,False,False,0,2,0,0,0,0,0,0,"放属性アースシャードを集められましたか？
よろしければ、回収させていただきます。","","","","ご協力に感謝します！
アインハルト家を代表してお礼申し上げます！","","この資源は、いくらあっても困りません。
また収集されましたら、お届けくださいね！",""
314,1,1,1,1,1,1,1,1,0,0,0,0,0,0,0,0,1,1,1,1,1,1,1,1,0,0,0,0,0,0,0,0,0,0,0,0,0,0,0,0,False,False,False,False,False,False,False,False,0,0,0,0,0,0,0,0,"放属性アースシャードは、
その名のとおり、属性の力を放つ作用があります。
ディアデム諸島の貴重な資源と言えるでしょう。","","","","","","",""
315,1,1,1,1,1,1,1,1,0,0,0,0,0,0,0,0,1,1,1,1,1,1,1,1,0,0,0,0,0,0,0,0,0,0,0,0,0,0,0,0,False,False,False,False,False,False,False,False,0,2,0,0,0,0,0,0,"放属性アースシャードをお持ちでしたら、
回収させていただきます。","","","","さらなるご協力に感謝します！","","この資源は、いくらあっても困りません。
また収集されましたら、お届けくださいね！",""
316,1,1,1,1,1,1,1,1,0,0,0,0,0,0,0,0,1,1,1,1,1,1,1,1,0,0,0,0,0,0,0,0,0,0,0,0,0,0,0,0,False,False,False,False,False,False,False,False,0,3,0,0,0,0,0,0,"私は、アインハルト家に仕える工兵です。
放属性アイスシャードの収集に、
協力願えませんか？","手伝いますか？","","","","","……そうですか。
ご自身の探索計画もあるでしょうから、仕方ありません。
気が変わりましたら、お声がけ願います。",""
317,1,1,1,1,1,1,1,1,0,0,0,0,0,0,0,0,1,1,1,1,1,1,1,1,0,0,0,0,0,0,0,0,0,0,0,0,0,0,0,0,False,False,False,False,False,False,False,False,0,0,0,0,0,0,0,0,"地表に凝固した放属性アイスシャードを採取するか、
アイススプライトを倒すことで、集めてください。","","","","","","",""
318,1,1,1,1,1,1,1,1,0,0,0,0,0,0,0,0,1,1,1,1,1,1,1,1,0,0,0,0,0,0,0,0,0,0,0,0,0,0,0,0,False,False,False,False,False,False,False,False,0,2,0,0,0,0,0,0,"放属性アイスシャードを集められましたか？
よろしければ、回収させていただきます。","","","","ご協力に感謝します！
アインハルト家を代表してお礼申し上げます！","","この資源は、いくらあっても困りません。
また収集されましたら、お届けくださいね！",""
319,1,1,1,1,1,1,1,1,0,0,0,0,0,0,0,0,1,1,1,1,1,1,1,1,0,0,0,0,0,0,0,0,0,0,0,0,0,0,0,0,False,False,False,False,False,False,False,False,0,0,0,0,0,0,0,0,"放属性アイスシャードは、
その名のとおり、属性の力を放つ作用があります。
ディアデム諸島の貴重な資源と言えるでしょう。","","","","","","",""
320,1,1,1,1,1,1,1,1,0,0,0,0,0,0,0,0,1,1,1,1,1,1,1,1,0,0,0,0,0,0,0,0,0,0,0,0,0,0,0,0,False,False,False,False,False,False,False,False,0,2,0,0,0,0,0,0,"放属性アイスシャードをお持ちでしたら、
回収させていただきます。","","","","さらなるご協力に感謝します！","","この資源は、いくらあっても困りません。
また収集されましたら、お届けくださいね！",""
321,1,1,1,1,1,1,1,1,0,0,0,0,0,0,0,0,1,1,1,1,1,1,1,1,0,0,0,0,0,0,0,0,0,0,0,0,0,0,0,0,False,False,False,False,False,False,False,False,0,3,0,0,0,0,0,0,"私は、アインハルト家に仕える工兵です。
放属性ウォーターシャードの収集に、
協力願えませんか？","手伝いますか？","","","","","……そうですか。
ご自身の探索計画もあるでしょうから、仕方ありません。
気が変わりましたら、お声がけ願います。",""
322,1,1,1,1,1,1,1,1,0,0,0,0,0,0,0,0,1,1,1,1,1,1,1,1,0,0,0,0,0,0,0,0,0,0,0,0,0,0,0,0,False,False,False,False,False,False,False,False,0,0,0,0,0,0,0,0,"地表に凝固した放属性ウォーターシャードを採取するか、
ウォータースプライトを倒すことで、集めてください。","","","","","","",""
323,1,1,1,1,1,1,1,1,0,0,0,0,0,0,0,0,1,1,1,1,1,1,1,1,0,0,0,0,0,0,0,0,0,0,0,0,0,0,0,0,False,False,False,False,False,False,False,False,0,2,0,0,0,0,0,0,"放属性ウォーターシャードを集められましたか？
よろしければ、回収させていただきます。","","","","ご協力に感謝します！
アインハルト家を代表してお礼申し上げます！","","この資源は、いくらあっても困りません。
また収集されましたら、お届けくださいね！",""
324,1,1,1,1,1,1,1,1,0,0,0,0,0,0,0,0,1,1,1,1,1,1,1,1,0,0,0,0,0,0,0,0,0,0,0,0,0,0,0,0,False,False,False,False,False,False,False,False,0,0,0,0,0,0,0,0,"放属性ウォーターシャードは、
その名のとおり、属性の力を放つ作用があります。
ディアデム諸島の貴重な資源と言えるでしょう。","","","","","","",""
325,1,1,1,1,1,1,1,1,0,0,0,0,0,0,0,0,1,1,1,1,1,1,1,1,0,0,0,0,0,0,0,0,0,0,0,0,0,0,0,0,False,False,False,False,False,False,False,False,0,2,0,0,0,0,0,0,"放属性ウォーターシャードをお持ちでしたら、
回収させていただきます。","","","","さらなるご協力に感謝します！","","この資源は、いくらあっても困りません。
また収集されましたら、お届けくださいね！",""
326,1,1,1,1,1,1,1,1,0,0,0,0,0,0,0,0,1,1,1,1,1,1,1,1,0,0,0,0,0,0,0,0,0,0,0,0,0,0,0,0,False,False,False,False,False,False,False,False,0,3,0,0,0,0,0,0,"私は、アインハルト家に仕える工兵です。
放属性ウィンドシャードの収集に、
協力願えませんか？","手伝いますか？","","","","","……そうですか。
ご自身の探索計画もあるでしょうから、仕方ありません。
気が変わりましたら、お声がけ願います。",""
327,1,1,1,1,1,1,1,1,0,0,0,0,0,0,0,0,1,1,1,1,1,1,1,1,0,0,0,0,0,0,0,0,0,0,0,0,0,0,0,0,False,False,False,False,False,False,False,False,0,0,0,0,0,0,0,0,"地表に凝固した放属性ウィンドシャードを採取するか、
ウィンドスプライトを倒すことで、集めてください。","","","","","","",""
328,1,1,1,1,1,1,1,1,0,0,0,0,0,0,0,0,1,1,1,1,1,1,1,1,0,0,0,0,0,0,0,0,0,0,0,0,0,0,0,0,False,False,False,False,False,False,False,False,0,2,0,0,0,0,0,0,"放属性ウィンドシャードを集められましたか？
よろしければ、回収させていただきます。","","","","ご協力に感謝します！
アインハルト家を代表してお礼申し上げます！","","この資源は、いくらあっても困りません。
また収集されましたら、お届けくださいね！",""
329,1,1,1,1,1,1,1,1,0,0,0,0,0,0,0,0,1,1,1,1,1,1,1,1,0,0,0,0,0,0,0,0,0,0,0,0,0,0,0,0,False,False,False,False,False,False,False,False,0,0,0,0,0,0,0,0,"放属性ウィンドシャードは、
その名のとおり、属性の力を放つ作用があります。
ディアデム諸島の貴重な資源と言えるでしょう。","","","","","","",""
330,1,1,1,1,1,1,1,1,0,0,0,0,0,0,0,0,1,1,1,1,1,1,1,1,0,0,0,0,0,0,0,0,0,0,0,0,0,0,0,0,False,False,False,False,False,False,False,False,0,2,0,0,0,0,0,0,"放属性ウィンドシャードをお持ちでしたら、
回収させていただきます。","","","","さらなるご協力に感謝します！","","この資源は、いくらあっても困りません。
また収集されましたら、お届けくださいね！",""
331,1,1,1,1,1,1,1,1,0,0,0,0,0,0,0,0,1,1,1,1,1,1,1,1,0,0,0,0,0,0,0,0,0,0,0,0,0,0,0,0,False,False,False,False,False,False,False,False,0,0,3,0,0,0,0,0,"聞いておくれよ！
田植えに備えて「稲の苗」を運んでいたら、
泥棒ナマズオが、力尽くで奪おうとしてきたんだ！","苗がなけりゃ、来年には餓死者が出かねない！
旅人さん、後生だから、泥棒ナマズオを懲らしめて、
「稲の苗」を取り返してくれないかい？","稲の苗を取り返す？

<UIForeground>F201F4</UIForeground><UIGlow>F201F5</UIGlow>※このF.A.T.E.の推奨レベルは<Value>IntegerParameter(1)</Value>です。<UIGlow>01</UIGlow><UIForeground>01</UIForeground>","","本当かい！？　そいつは助かるよ！
泥棒ナマズオを懲らしめながら、散らばっている、
「稲の苗」も集めて、持って来ておくれ！","","ナマズオに苗を奪われた、私が悪いってことだね。
そうかい……今年ぶんの米を食い終わったら、
身投げでも考えるとするよ……。",""
332,1,1,1,1,1,1,1,1,0,0,0,0,0,0,0,0,1,1,1,1,1,1,1,1,0,0,0,0,0,0,0,0,0,0,0,0,0,0,0,0,False,False,False,False,False,False,False,False,0,0,0,0,0,0,0,0,"シュー……最低限の数は取り戻せた。
だが、「奪われた装飾具」は、まだあるはず……。
もしも取り戻せたなら、持って来てくれ。","","","","","","",""
333,1,1,1,1,1,1,1,1,0,0,0,0,0,0,0,0,1,1,1,1,1,1,1,1,0,0,0,0,0,0,0,0,0,0,0,0,0,0,0,0,False,False,False,False,False,False,False,False,0,3,0,0,0,0,0,0,"冒険者さん、ちょうどいいところに……。
矢尻の材料になる「鋭い石片」を集めるのを、
手伝ってはもらえませんか？","メ族の少女を手伝う？

<UIForeground>F201F4</UIForeground><UIGlow>F201F5</UIGlow>※このF.A.T.E.の推奨レベルは<Value>IntegerParameter(1)</Value>です。<UIGlow>01</UIGlow><UIForeground>01</UIForeground>","","","ありがとうございます！
「鋭い石片」は、この辺りに落ちていますし、
ハイランド・ダラを倒しても手に入りますよ。","","そうですか……
もし気が変わったら声をかけてくださいね",""
334,1,1,1,1,1,1,1,1,0,0,0,0,0,0,0,0,1,1,1,1,1,1,1,1,0,0,0,0,0,0,0,0,0,0,0,0,0,0,0,0,False,False,False,False,False,False,False,False,0,2,0,0,0,0,0,0,"「鋭い石片」は集まりましたか？
お持ちでしたら受け取りますよ。","渡しますか？","","","ありがとうございます！
この辺りの石は、矢尻を作るのに最適なんです。
きっといい狩り用の矢が作れますよ！","","そうですか……
もし気が変わったら声をかけてくださいね",""
335,1,1,1,1,1,1,1,1,0,0,0,0,0,0,0,0,1,1,1,1,1,1,1,1,0,0,0,0,0,0,0,0,0,0,0,0,0,0,0,0,False,False,False,False,False,False,False,False,0,0,3,0,0,0,0,0,"お、驚いたな……。
見回りに来たら、物凄い数の卵を見つけたんだ！
間違いない、あれは「ベニツノの卵」だよ！","あの数の卵が孵ったとしたら……
どれだけの鳥害があるか、わかったもんじゃない！
よかったら、卵を回収してくれないかい？","卵を回収する？

<UIForeground>F201F4</UIForeground><UIGlow>F201F5</UIGlow>※このF.A.T.E.の推奨レベルは<Value>IntegerParameter(1)</Value>です。<UIGlow>01</UIGlow><UIForeground>01</UIForeground>","","快く引き受けてくれて、感謝するよ！
「ベニツノの卵」だが、産み落とされたものはもちろん、
親のムニ・ベニツノを倒しても、手に入るはずだぞ！","","仕方あるまい……。
ここから石でも投げて、卵を割ってみるか……。
いや、そんなことをしたら、親鳥に逆襲されそうだな。",""
336,1,1,1,1,1,1,1,1,0,0,0,0,0,0,0,0,1,1,1,1,1,1,1,1,0,0,0,0,0,0,0,0,0,0,0,0,0,0,0,0,False,False,False,False,False,False,False,False,0,0,0,0,0,0,0,0,"「稲の苗」なら泥棒ナマズオが持っているよ。
それに、襲われたときに散らばったものもあるから、
拾い集めてくれると、助かるってものさ。","","","","","","",""
337,1,1,1,1,1,1,1,1,0,0,0,0,0,0,0,0,1,1,1,1,1,1,1,1,0,0,0,0,0,0,0,0,0,0,0,0,0,0,0,0,False,False,False,False,False,False,False,False,0,0,0,0,0,0,0,0,"「鋭い石片」を集めてきてください。
この辺りに落ちていますし、
ハイランド・ダラを倒しても手に入りますよ。","","","","","","",""
338,1,1,1,1,1,1,1,1,0,0,0,0,0,0,0,0,1,1,1,1,1,1,1,1,0,0,0,0,0,0,0,0,0,0,0,0,0,0,0,0,False,False,False,False,False,False,False,False,0,2,0,0,0,0,0,0,"「鋭い石片」は、いくらあっても困りません。
お持ちでしたら受け取りますよ。","渡しますか？","","","こんなにたくさん集めていただけるなんて！
ありがとうございました！","","あれ、冒険者さんも矢尻を作るんですか？
この辺りの「鋭い石片」は、品質がいいですものね！",""
339,1,1,1,1,1,1,1,1,0,0,0,0,0,0,0,0,1,1,1,1,1,1,1,1,0,0,0,0,0,0,0,0,0,0,0,0,0,0,0,0,False,False,False,False,False,False,False,False,0,0,0,0,0,0,0,0,"「鋭い石片」は、いくらあっても困りません。
お持ちでしたら受け取りますよ。","","","","","","",""
340,1,1,1,1,1,1,1,1,0,0,0,0,0,0,0,0,1,1,1,1,1,1,1,1,0,0,0,0,0,0,0,0,0,0,0,0,0,0,0,0,False,False,False,False,False,False,False,False,0,2,0,0,0,0,0,0,"シュー……ありがとう、感謝するぞ。
しかし、これほどの数の装飾具を盗むとは……
カリヤナ派のなんと強欲なことか！","","","","シュー……かなりの数が取り戻せた。
だが、「奪われた装飾具」は、まだあるはず……。
もしも取り戻せたなら、持って来てくれ。","","シュー……疑いたくはないが、
その品を持ち逃げする気ではあるまいな？",""
341,1,1,1,1,1,1,1,1,0,0,0,0,0,0,0,0,1,1,1,1,1,1,1,1,0,0,0,0,0,0,0,0,0,0,0,0,0,0,0,0,False,False,False,False,False,False,False,False,0,0,3,0,0,0,0,0,"君はアラミゴ解放軍の協力者か？
ならば、周辺地域の安全確保のために、
巡回に同行してほしいのだが……。","実は、同行するはずの仲間が遅れていてね。
予定どおりに任務を終えるためにも、そろそろ出発したいのだ。
どうだ、やってくれるか？","巡回に同行する？

<UIForeground>F201F4</UIForeground><UIGlow>F201F5</UIGlow>※このF.A.T.E.の推奨レベルは<Value>IntegerParameter(1)</Value>です。<UIGlow>01</UIGlow><UIForeground>01</UIForeground>","","","","そうか……残念だが、仕方ない。
もう少しだけ、仲間の到着をここで待ってみよう……。",""
342,1,1,1,1,1,1,1,1,0,0,0,0,0,0,0,0,1,1,1,1,1,1,1,1,0,0,0,0,0,0,0,0,0,0,0,0,0,0,0,0,False,False,False,False,False,False,False,False,0,0,0,0,0,0,0,0,"シュー……
「奪われた装飾具」は、カリヤナ派の拠点に、
保管されているはず……見張りに注意してくれよ。","","","","","","",""
343,1,1,1,1,1,1,1,1,0,0,0,0,0,0,0,0,1,1,1,1,1,1,1,1,0,0,0,0,0,0,0,0,0,0,0,0,0,0,0,0,False,False,False,False,False,False,False,False,0,0,3,0,0,0,0,0,"シュー……臆病者のカリヤナ派の連中が、
卑怯にも、私が造り上げた装飾具を盗んでいった！
手間と魔力をかけて、姉妹のために作ったというのに！","だが、私は職人に過ぎず、力で取り戻すことはできない。
ヒトの子の友よ、もしも私を哀れに思うなら、
カリヤナ派に「奪われた装飾具」を奪還してきてくれぬか？","ウィルラの職人に手を貸す？

<UIForeground>F201F4</UIForeground><UIGlow>F201F5</UIGlow>※このF.A.T.E.の推奨レベルは<Value>IntegerParameter(1)</Value>です。<UIGlow>01</UIGlow><UIForeground>01</UIForeground>","","シュー……なんという慈悲深さ！
「奪われた装飾具」は、カリヤナ派の拠点に、
保管されているはず……見張りに注意してくれよ。","","シュー……確かにこれは、アナンタ族の問題だ。
ヒトの子の友には関係のないことだったな。
強欲な申し出、忘れてくれ。",""
344,1,1,1,1,1,1,1,1,0,0,0,0,0,0,0,0,1,1,1,1,1,1,1,1,0,0,0,0,0,0,0,0,0,0,0,0,0,0,0,0,False,False,False,False,False,False,False,False,0,2,0,0,0,0,0,0,"シュー……その輝き！
まさしく私が姉妹のために作った品に違いない！","","","","シュー……これで我が姉妹を、
美しく飾ってやることができるというもの……。
慈悲深きヒトの子の友に、感謝の念を捧げよう。","","シュー……疑いたくはないが、
その品を持ち逃げする気ではあるまいな？",""
