36,"ミスリルキャバルリーボウ",1,"ヤーゾンハープーン",1,"",1,"ザワークラウト",3,"チーズスフレ",3,"",1,"暗闇の猛毒薬",3,"睡眠の猛毒薬",3,"沈黙の猛毒薬",3,"スチールフライパン",1,"",1,"",1,"ボアリングバンド",1,"ボアリストバンド",1,"ボアギャザラーリストバンド",1,"ウルフファングネックレス",1,"ミスリルリング",1,"アクアマリンチョーカー",1,"アングラーハット",1,"リネンカウル",1,"リネントラウザー",1,"ラップド・スチールクローハンマー",1,"ラップドスチールアウル",1,"",1,"トルマリン原石",10,"",1,"",1,"アイアンエーコン",10,"ブラッドカーラント",10,"",1,"銀魚",1,"クラウンローチ",1,"サンドブリーム",1
37,"パストラルオークケーン",1,"ホーンフィッシングロッド",1,"",1,"ラタトゥイユ",3,"",1,"",1,"ブック・オブ・シルバーDX",1,"",1,"",1,"ダブルブレードシールド",1,"",1,"",1,"ボアサブリガ",1,"ボアポットヘルム",1,"オルタード・ボアポットヘルム",1,"アクアマリンチョーカー",1,"ガーネットチョーカー",1,"ペリドットチョーカー",1,"リネン・クラフターウェッジキャップ",1,"リネンゲイター",1,"リネンボトム",1,"スチールロングソード",1,"",1,"",1,"スピネル原石",10,"",1,"",1,"マグワート",10,"",1,"",1,"アーマードプレコ",1,"スナナマズ",1,"バルーンフィッシュ",1
38,"ミスリルランス",1,"",1,"",1,"カープ&マグワート",3,"ナイツブレッド",3,"",1,"バッデッドオークワンド",1,"",1,"",1,"ホーンスケイルフィンガー",1,"ミスリルチェラータ",1,"",1,"ペイストクラコー",1,"ペイストフィンガレスグローブ",1,"ボアブリーチ",1,"アクアマリンブレスレット",1,"ゴシェナイトブレスレット",1,"ホワイトパールブレスレット",1,"リネン・ギャザラーウェッジキャップ",1,"リネンクラフターコーティー",1,"リネンショーティ",1,"プルームドミスリルピック",1,"ミスリルブロードソード",1,"ミスリルハチェット",1,"ジルコン原石",10,"",1,"",1,"アーティチョーク",10,"",1,"",1,"ベロジナカープ",1,"スポテッドパファー",1,"ドトンフィッシュ",1
39,"オークパッテン",1,"",1,"",1,"スタッフドアーティチョーク",3,"ラプトルシチュー",3,"",1,"アースワンド",1,"アイスワンド",1,"ウォーターワンド",1,"ミスリルガントレット",1,"ミスリルキュイラス",1,"ミスリルサバトン",1,"ボアサイブーツ",1,"ペイストハーネス",1,"ボアリング",1,"アクアマリンイヤリング",1,"アメジストイヤリング",1,"ガーネットリング",1,"ウールコイフ",1,"ウールターバン",1,"リネントラウザーDX",1,"スパイクドミスリルラブリュス",1,"ミスリルクロー",1,"ミスリルヘッドナイフ",1,"ジェード",10,"",1,"",1,"ナツメグ",10,"タイム",10,"",1,"サンドストームライダー",1,"ナルザルイール",1,"",1
40,"オークコンポジットボウ",1,"マホガニースピニングホイール",1,"マホガニーフィッシングロッド",1,"アップルジュース",3,"ペストリーフィッシュ",3,"雨乞魚のグリル",3,"きつけ薬",3,"",1,"",1,"ホーンスケイルメイル",1,"ミスリルエルモ",1,"ミスリルアレンビック",1,"ボアスミスグローブ",1,"ボアダックビル",1,"",1,"ヘリオドールイヤリング",1,"ペリドットリング",1,"レッドコーラルアルミラ",1,"ウールギャザラーコイフ",1,"ウールサルエル",1,"ウールハット",1,"ミスリルオーナメンタルハンマー",1,"ミスリルブージ",1,"ミスリルアウル",1,"ブラックアルメン",10,"グレネードの灰",10,"",1,"アーモンド",10,"",1,"",1,"ディスカス",1,"アントリオンスラッグ",1,"",1
41,"コンドルマクアフティル",1,"",1,"",1,"ビーフジャーキー",3,"",1,"",1,"",1,"",1,"",1,"ミスリルクラッドブーツ",1,"ミスリルバルビュート",1,"ミスリルヴァンブレイス",1,"ペイストサブリガ",1,"ボアキュロット",1,"ボアスカート",1,"ホーンスタッフ",1,"ホワイトパールリング",1,"ミスリルイヤーカフス",1,"ウールタイツ",1,"スモック",1,"ウールドレスグローブ",1,"ミスリルクリナリーナイフ",1,"ミスリルモーター",1,"",1,"ターコイズ原石",10,"",1,"",1,"サゴリーセージ",10,"",1,"",1,"デューンマンタ",1,"シルバーシャーク",1,"",1
42,"リーヴドローズラディカル",1,"",1,"",1,"ソルトコッドパフ",3,"",1,"",1,"ブック・オブ・ミスリル",1,"",1,"",1,"ミスリルアーマードカリガ",1,"メセイル",1,"ミスリルチェーンコイフ",1,"ボアワークブーツ",1,"ラプトルタージェ",1,"",1,"ミスリルサークレット(スピネル)",1,"ミスリルサークレット(ルベライト)",1,"トータスホラ",1,"リネンスロップ",1,"ウールショース",1,"ウールガウン",1,"ミスリルプライヤー",1,"コバルトナックル",1,"ミスリルラウンドナイフ",1,"青金砂",10,"",1,"",1,"シャインアップル",10,"ブラックスコーピオン",10,"",1,"ロイヤルプレコ",1,"雷紋魚",1,"",1
43,"ガーネットグラインディングホイール",1,"ローズフィッシングロッド",1,"",1,"フィッシュスープ",3,"",1,"",1,"メガポーション",3,"",1,"",1,"ミスリルミトンガントレット",1,"コバルトスキレット",1,"ヘヴィミスリルフランチャード",1,"ボアジャーキン",1,"ラプトルチョーカー",1,"ボアリングバンド(ウィンド)",1,"サウザンドニードル",1,"ウォーターブランド",1,"エレクトラムイヤリング",1,"ウールハーフグローブ",1,"ウールトラウザー",1,"フェルトコイフ",1,"シャムシール",1,"コバルトハチェット",1,"コバルトドラブラ",1,"青金鉱",10,"",1,"",1,"ロランベリー",10,"",1,"",1,"タキノボリ",1,"ナイフフィッシュ",1,"ワフー",1
44,"コバルトハルバード",1,"ジェイドクルーク",1,"",1,"キノコのガーリックソテー",3,"ゼーメル家風グラタン",3,"",1,"心力の秘薬",3,"",1,"",1,"ミスリルエルモDX",1,"コバルトスクトゥム",1,"ヘヴィミスリルアーマー",1,"ラプトル・ギャザラーフィンガレスグローブ",1,"ラプトルサブリガ",1,"ラプトルスミスグローブ",1,"エレクトラムリング",1,"コバルトプリザーヴ",1,"ブラックホーンスタッフ",1,"ウールスモック",1,"フェルトハット",1,"ウールスロップ",1,"コバルトアウル",1,"コバルトモール",1,"コバルトクローハンマー",1,"アンバー原石",10,"",1,"",1,"ミスルトゥ",10,"",1,"",1,"オークルート",1,"スカルピン",1,"",1
45,"イーグルシールド",1,"コバルトクラッドボウ",1,"ローズウッド・スピニングホイール",1,"パイクのキャベツ巻き",3,"ラノシアトースト",3,"",1,"ウィンドワンド",1,"剛力の秘薬",3,"知力の秘薬",3,"コバルトクラッドブーツ",1,"トータススケイルメイル",1,"トータススケイルフィンガー",1,"ラプトルポットヘルム",1,"ラプトルキュロット",1,"ラプトルワークブーツ",1,"レッドコーラルネックレス",1,"エレクトラムサークレット(スピネル)",1,"エレクトラムクラフターリング",1,"フェルトショース",1,"レインメイカーハット",1,"フェルトケクス",1,"デミルーンブージ",1,"コバルトファイル",1,"コバルトモーター",1,"ルベライト原石",10,"",1,"",1,"ダートフロッグ",10,"",1,"",1,"サウザンパイク",1,"射手魚",1,"クラウドジェリー",1
46,"ユーロングボウ",1,"",1,"",1,"デビルドエッグズ",3,"",1,"",1,"活力の秘薬",3,"眼力の秘薬",3,"金の針",3,"コバルトバルビュート",1,"コバルトアーマードカリガ",1,"",1,"ラプトルサイブーツ",1,"ラプトルブレー",1,"",1,"エレクトラムサークレット(ルベライト)",1,"ジルコンチョーカー",1,"",1,"フェルトベレー",1,"フェルトワークグローブ",1,"フェルトドレスシューズ",1,"レリーフコバルトソー",1,"エレクトラムヘッドナイフ",1,"エレクトラムラピダリーハンマー",1,"バジリスクの卵",10,"",1,"",1,"ローズウッド原木",10,"",1,"",1,"ゴブリンパーチ",1,"アジェレスカープ",1,"パイクイール",1
47,"トライデント",1,"バジリスクグラインディングホイール",1,"",1,"マルドティー",3,"",1,"",1,"劇毒薬",3,"麻痺の劇毒薬",3,"",1,"イフリートフライパン",1,"",1,"",1,"ハンティングモカシン",1,"ラプトルジャーキン",1,"",1,"アンバーブレスレット",1,"スピネルブレスレット",1,"アンバーリング",1,"フェルトガスキン",1,"フェルトキャバリエハット",1,"ウールトラウザーDX",1,"コバルトレイジングハンマー",1,"",1,"",1,"鏡鉄鉱",10,"",1,"",1,"ローズウッドの枝",10,"",1,"",1,"アサシンベタ",1,"スカイフィッシュ",1,"ハンプヘッド",1
48,"マホガニーパッテン",1,"ローズフィッシングロッドDX",1,"",1,"ガレット・デ・ロワ",1,"",1,"",1,"睡眠の劇毒薬",3,"ブック・オブ・エレクトラムDX",1,"バッデッドローズワンド",1,"コバルトミトンガントレット",1,"",1,"",1,"ラプトルリング",1,"オックスブラッドタージェ",1,"",1,"トルマリンチョーカー",1,"ブラックパールブレスレット",1,"ルベライトブレスレット",1,"フェルトブリオー",1,"フェルトトラウザー",1,"フェルトドレスグローブ",1,"イーグレットドラブラ",1,"ホーンドハチェット",1,"",1,"",1,"",1,"",1,"ザナラーン茶葉",10,"",1,"",1,"ガー",1,"フライマンタ",1,"プレイス",1
49,"クラブボウ",1,"",1,"",1,"キノコのキャベツ巻き",3,"",1,"",1,"暗闇の劇毒薬",3,"",1,"",1,"コバルトメセイル",1,"コバルトサレット",1,"コバルト・ダブルブレードシールド",1,"ラプトルジャケット",1,"ラプトルブーツ",1,"",1,"スピネルリング",1,"エレクトラムイヤーカフス",1,"ジェイドセプター",1,"パトリシアンウェッジキャップ",1,"パトリシアングローブ",1,"",1,"ウィングレット",1,"コバルトクロー",1,"",1,"陸亀の甲羅",10,"",1,"",1,"ラーヴァトード",10,"",1,"",1,"パガルザンディスカス",1,"ボクシングプレコ",1,"リフトセイラー",1
50,"ハートギザルメ",1,"",1,"",1,"エフトステーキ",3,"ビーフシチュー",3,"ブイヤベース",3,"タネ・マフタ",1,"",1,"",1,"コバルトホーバージョン",1,"",1,"",1,"ラプトルレッグガード",1,"",1,"",1,"アイボリースタッフ",1,"スピネルイヤリング",1,"トルマリンイヤリング",1,"パトリシアンゲイター",1,"パトリシアンコーティー",1,"パトリシアンボトム",1,"スパイクドコバルトラブリュス",1,"",1,"",1,"オーガの角",10,"大龍黒曜石",10,"黄銅鉱",10,"シーダーの枝",10,"シーダー原木",10,"",1,"ニメーヤトラウト",1,"サゴリーモンクフィッシュ",1,"ソーサーフィッシュ",1
51,"ミスライトトライデント",1,"シーダーロングボウ",1,"シーダークルーク",1,"ババロア・オ・フィグ",3,"",1,"",1,"アルケオーニスグリモア",1,"アルケオーニスコーデックス",1,"",1,"ミスライトディフェンダーガントレット",1,"ミスライトスレイヤーサレット",1,"ミスライトスレイヤーホーバーク",1,"アルケオーニススレイヤーブリーチ",1,"アルケオーニススカウトブーツ",1,"アルケオーニスクラフターグローブ",1,"イエティスタッフ",1,"ミスライトレンジャーバングル",1,"ミスライトクラフターゴーグル",1,"レインボークロス・ストライカーキュロット",1,"レインボークロス・スカウトコイフ",1,"レインボークロス・キャスターローブ",1,"ミスライトウォーアクス",1,"ミスライトクレイモア",1,"ミスライトアークウィバス",1,"精霊銀砂",10,"アゲート原石",10,"黄鉄鉱",10,"虹綿",10,"",1,"",1,"白雲珊瑚",1,"ハルオネ",1,"スカイワーム",1
52,"ミスライトパジルスティック",1,"ホーリーシーダー・コンポジットボウ",1,"シーダーフィッシングロッド",1,"オニオングラタンスープ",3,"挽肉のキャベツ巻き",3,"",1,"ワイバーングリモア",1,"ワイバーンコーデックス",1,"ホーリーシーダーワンド",1,"ミスライトアレンビック",1,"サボテンダーフライパン",1,"",1,"アルケオーニス・ギャザラージャックコート",1,"アルケオーニスクラフターブリーチ",1,"ワイバーンキャスターグローブ",1,"ミスライトディフェンダーブレスレット",1,"ミスライトニードル",1,"イエティファングイヤリング",1,"ホーリーレインボー・ディフェンダーサルエル",1,"ホーリーレインボー・レンジャーハット",1,"ホーリーレインボー・ヒーラーサルエル",1,"ミスライトランプハンマー",1,"ミスライトラウンドナイフ",1,"ミスライトピック",1,"タイガーズアイ原石",10,"イエロークォーツ",10,"",1,"イノンド",10,"",1,"",1,"ファングクラム",1,"アカザ",1,"ソーサラーフィッシュ",1
53,"アストラルグラインディングホイール",1,"ホーリーシーダー・スピニングホイール",1,"ホーリーシーダーアルミラ",1,"イシュガルドマフィン",3,"ポルチーニソテー",3,"",1,"剛力の錬金溶剤G1",3,"眼力の錬金溶剤G1",3,"",1,"ミスライトブレードシールド",1,"",1,"",1,"ワイバーンディフェンダーメイン",1,"ワイバーンヒーラーブーツ",1,"ワイバーンリストバンド",1,"オブシディアンロングポール",1,"ミスライトアタッカーネックレス",1,"イエティファング・ヒーラーリング",1,"ホーリーレインボー・スレイヤーシャツ",1,"ホーリーレインボー・ストライカーシャツ",1,"ホーリーレインボー・ワークグローブ",1,"ミスライトフレイムタン",1,"ミスライトジャマダル",1,"ミスライトスティレット",1,"ラリマール原石",10,"輝銅鉱",10,"",1,"ハイランド小麦",10,"",1,"",1,"マイボイ",1,"ノーブルシーマ",1,"スカイフェアリー・セレネ",1
54,"チタンランス",1,"ダークチェスナット・ロングボウ",1,"ホーリーシーダーネックレス",1,"アウフラウフ",3,"",1,"",1,"活力の錬金溶剤G1",3,"心力の錬金溶剤G1",3,"",1,"チタンレンジャーマスク",1,"チタンスレイヤーサレット",1,"ハードシルバーアレンビック",1,"ダルメル・スカウトアームガード",1,"ワイバーンキュロット",1,"ワイバーンジャーキン",1,"ハードシルバースタッフ",1,"モルモリオンディフェンダーリング",1,"ハードシルバーニードル",1,"ラミー・キャスターハーフグローブ",1,"ラミーリボン・オブ・ディフェンス",1,"ホーリーレインボー・ドレスシューズ",1,"チタンアクス",1,"チタンクレイモア",1,"チタンアークウィバス",1,"ドラヴァニア天然水",10,"モルモリオン原石",10,"褐鉄鉱",10,"青麻",10,"ダークチェスナット原木",10,"",1,"アンモナイト",1,"出目金",1,"キッシング・グラミー",1
55,"ダークチェスナット・フィッシングロッド",1,"",1,"",1,"オランデーズソース",1,"",1,"",1,"ダルメルグリモア",1,"ダルメルコーデックス",1,"",1,"チタンカイトシールド",1,"チタンディフェンダーメイル",1,"チタンスレイヤーサバトン",1,"ダルメルストライカージャケット",1,"ダルメルレンジャーレギンス",1,"ダルメルハーフグローブ",1,"ハードシルバー・スターグローブ",1,"ハードシルバー・アタッカーイヤリング",1,"ハードシルバー・レンジャーバングル",1,"ラミースカウトトラウザー",1,"ラミーヒーラーローブ",1,"ラミークラフターターバン",1,"ハードシルバーソー",1,"ハードシルバー・ゴールドスミスハンマー",1,"チタンハチェット",1,"スターサファイア原石",10,"スタールビー原石",10,"グリーンクォーツ",10,"ダークチェスナットの枝",10,"マグマビート",10,"",1,"アストロノータス",1,"アバーブクラウド",1,"氷神魚",1
56,"ハロードチェスナット・コンポジットボウ",1,"ハロードチェスナット・ヒーラーマスク",1,"ダークチェスナット・スピニングホイール",1,"エメラルドスープ",3,"",1,"",1,"ドラゴンレザーグリモア",1,"ドラゴンレザーコーデックス",1,"",1,"チタンディフェンダーヘルム",1,"チタンスレイヤーヴァンブレイス",1,"チタンスカウトヘッドギア",1,"ドラゴンレザー・レンジャーグローブ",1,"ドラゴンレザー・ヒーラーグローブ",1,"ダルメルフリンジブーツ",1,"オパールヒーラーリング",1,"オパールキャスターブレスレット",1,"ドラゴンファングイヤリング",1,"ラミースカート",1,"ラミークラフターダブレット",1,"ラミーギャザラートラウザー",1,"チタンプライヤー",1,"チタンアウル",1,"チタンモール",1,"硬銀砂",10,"古竜骨片",10,"",1,"エキナセア",10,"スカイウィドー",10,"",1,"ジャウー",1,"ゴブリパス",1,"スカイメデューサ",1
57,"ハロードチェスナット・フィッシングロッド",1,"ハロードチェスナットリング",1,"",1,"エッグロワイヤル",3,"ダルメルフリカッセ",3,"",1,"ハロードチェスナットワンド",1,"",1,"",1,"チタンディフェンダーサバトン",1,"チタンストライカーメイル",1,"マンドラーズフライパン",1,"ドラゴンレザー・ディフェンダーブリーチ",1,"ドラゴンレザー・スカウトブリーチ",1,"ドラゴンレザー・キャスターブーツ",1,"ハードシルバープラニスフィア",1,"オパールディフェンダーチョーカー",1,"ハードシルバー・ギャザラーイヤリング",1,"ハロードラミー・レンジャーダブレット",1,"ハロードラミー・ヒーラーガスキン",1,"ハロードラミー・キャスターダブレット",1,"チタングレートソード",1,"チタンスナップハンス",1,"ハードシルバー・ラウンドナイフ",1,"オパール原石",10,"アバラシア天然水",10,"赤鉄鉱",10,"セサミ",10,"タンジー",10,"",1,"バタフライフィッシュ",1,"コメットータス",1,"学士貝",1
58,"アダマンスピア",1,"バーチロングボウ",1,"バーチシグナム",1,"フローズンカクテル",3,"ベイクドピピラ・ピラ",3,"",1,"ブック・オブ・オーラムレギス",1,"ピカトリクス・オブ・オーラムレギス",1,"眼力の竜薬",3,"アダマンディフェンダーガントレット",1,"アダマンスレイヤーヘルム",1,"アダマンスレイヤーサバトン",1,"アンフィプテレ・ストライカーアームガード",1,"アンフィプテレキャスターハット",1,"ドラゴンレザーチョーカー",1,"オーラムレギス・レンジャーブレスレット",1,"オーラムレギス・ヒーラーピアス",1,"ゴブリンジグ",1,"キマイラフェルト・ストライカーキャップ",1,"キマイラフェルト・ヒーラーグローブ",1,"キマイラフェルト・ヒーラークロブーク",1,"アダマンブロードソード",1,"アダマンビル",1,"アダマンナイフ",1,"白雲母",10,"カーネリアン原石",10,"赤銅鉱",10,"バーチの枝",10,"ヘンルーダ",10,"",1,"バルーンパファー",1,"スカイハイフィッシュ",1,"ロッククライマー",1
59,"ドラゴンスケイル・グラインディングホイール",1,"バーチスピニングホイール",1,"ハロードチェスナットネックレス",1,"レバーケースゼンメル",3,"",1,"",1,"活力の竜薬",3,"知力の竜薬",3,"心力の竜薬",3,"アダマンスクトゥム",1,"アダマンディフェンダーアーマー",1,"アダマン・スレイヤーチェーンホーズ",1,"アンフィプテレ・ヒーラーサイブーツ",1,"アンフィプテレストライカーブーツ",1,"アンフィプテレグローブ",1,"オーラムレギス・ロングポール",1,"グリフィンクロー・キャスターリング",1,"シトリンアタッカーチョーカー",1,"キマイラフェルト・レンジャーシクラス",1,"キマイラフェルト・スカウトホーズ",1,"キマイラフェルト・ヒーラーアルバ",1,"アダマンモーター",1,"アダマンクリナリーナイフ",1,"アダマンサイズ",1,"シトリン原石",10,"皇金砂",10,"テクタイト",10,"コリアンダー",10,"ダンデライオン",10,"バーチ樹液",10,"コブラフィッシュ",1,"バトルガレー",1,"フライングガーナード",1
60,"バーチコンポジットボウ",1,"バーチロッド",1,"バーチフィッシングロッド",1,"クラムチャウダー",3,"スタッフドキャベイジ",3,"",1,"コーデックス・オブ・オーラムレギス",1,"",1,"",1,"ヘヴィ・アダマンディフェンダーガントレット",1,"アダマンスレイヤーメイル",1,"オーラムレギス・ヒーラーソルレット",1,"アンフィプテレスカウトブレー",1,"アンフィプテレキャスターブーティ",1,"アンフィプテレベスト",1,"ブレーデッドジグ",1,"オーラムレギス・ヒーラーサークレット",1,"クリソライトヒーラーブレスレット",1,"キマイラフェルト・ストライカータバード",1,"キマイラフェルト・キャスターハット",1,"キマイラフェルトスカート",1,"アダマンナックル",1,"アダマングレートソード",1,"アダマンドラブラ",1,"クリソライト原石",10,"真龍黒曜石",10,"イブニングジェード",10,"クラウドマッシュルーム",10,"キャットニップ",10,"ペリウィンクル",10,"ヒンターランドパーチ",1,"ブラックメイジフィッシュ",1,"ヴァンパイアブランケット",1
61,"ハイスチールトライデント",1,"ビーチコンポジットボウ",1,"ムードスードホーン・フィッシングロッド",1,"ロークワットジュース",3,"バクラヴァ",3,"",1,"インデックス・オブ・キュプロ",1,"コーデックス・オブ・キュプロ",1,"",1,"ハイスチールディフェンダーヘルム",1,"ハイスチール・スレイヤーアームガード",1,"ハイスチール・ボムフライパン",1,"ガガナディフェンダーホーズ",1,"ガガナスカウトサンダル",1,"ガガナハーフグローブ",1,"キュプロプラニスフィア",1,"トリフェーンディフェンダーチョーカー",1,"トリフェーンレンジャーブレスレット",1,"レッドヘンプ・ヒーラーチェストラップ",1,"レッドヘンプ・クラフターターバン",1,"レッドヘンプ・ギャザラートラウザー",1,"ハイスチールカルバリン",1,"ハイスチールソー",1,"ハイスチール・クロスペインハンマー",1,"ギラバニア鉱泉水",10,"珪岩",10,"魔銅砂",10,"ビーチの枝",10,"ロークワット",10,"ビーチ原木",10,"ミューヌフィッシュ",1,"",1,"",1
62,"ラーチワンド",1,"スタイパーストーン・グラインディングホイール",1,"ラーチスピニングホイール",1,"蕎麦茶",3,"グリルドチャー",3,"カーシャ",3,"ギュウキグリモア",1,"ギュウキコーデックス",1,"強錬精薬",3,"ハイスチールスクトゥム",1,"ハイスチール・ディフェンダーバルビュート",1,"ハイスチール・スレイヤーバルビュート",1,"ギュウキポットヘルム",1,"ギュウキドレスグローブ",1,"ギュウキディフェンダートラウザー",1,"キュプロアタッカーブレスレット",1,"ムードスードホーン・ディフェンダーリング",1,"ムードスードホーン・キャスターリング",1,"ルビーコットン・スカウトバンダナ",1,"ルビーコットン・キャスターフィンガレスグローブ",1,"ルビーコットン・キャスターハット",1,"ハイスチールプライヤー",1,"ハイスチールモーター",1,"ハイスチールサイズ",1,"カイヤナイト原石",10,"粘板岩",10,"",1,"蕎麦の実",10,"マウンテンポポト",10,"玉藻",10,"紅玉珊瑚",1,"",1,"",1
