63,"ラーチイヤリング",1,"ラーチネックレス",1,"ラーチリング",1,"とろろ蕎麦",3,"サザエの壺焼",3,"",1,"眼力の霊水G1",3,"活力の霊水G1",3,"心力の霊水G1",3,"ハイスチール・ディフェンダーメイル",1,"ハイスチール・ディフェンダーガントレット",1,"ハイスチール・スレイヤーソルレット",1,"ギュウキ・スカウトハイブーツ",1,"ギュウキジャケット",1,"ギュウキチョーカー",1,"キュプロポール",1,"キュプロレイピア",1,"キュプロレンジャーピアス",1,"ルビーコットンサルエル",1,"ルビーコットンシャブル",1,"ルビーコットンキャップ",1,"ハイスチール・グレートソード",1,"ハイスチールスナップハンス",1,"不変鋼打刀",1,"魔銅鉱",10,"珪藻土",10,"",1,"ラーチ原木",10,"ホーリーバジル",10,"紅玉綿花",10,"トビウオ",1,"タマカイ",4,"",1
64,"ドマアイアンランス",1,"パインコンポジットボウ",1,"パインケーン",1,"クラブコロッケ",3,"豆腐の味噌汁",3,"",1,"名匠の薬茶",3,"カブトにかわ",1,"",1,"ドマアイアン・ディフェンダーグリーヴ",1,"ドマアイアン・スレイヤーガントレット",1,"ドマアイアン・ディフェンダーガントレット",1,"タイガー・スカウトリストグローブ",1,"タイガー・レンジャーリストグローブ",1,"タイガー・キャスターアームガード",1,"スタースピネル・アタッカーブレスレット",1,"スタースピネル・レンジャーブレスレット",1,"スタースピネル・ヒーラーリング",1,"クズクロス・スレイヤーロングキルト",1,"クズクロス・ヒーラーハット",1,"クズクロス・キャスターハット",1,"ドマアイアン・ロングソード",1,"ドマアイアン・レイジングハンマー",1,"ドマアイアンピック",1,"岩清水",10,"",1,"",1,"松脂",10,"シュガービート",10,"アマノリ",10,"ヤンサコイ",1,"泥仙人",4,"",1
65,"パインフィッシングロッド",1,"スレートグラインディングホイール",1,"パインスピニングホイール",1,"ショルログ",3,"カエルの餡かけ",3,"がめ煮",3,"タイガーグリモア",1,"タイガーコーデックス",1,"巨匠の薬茶",3,"ドマアイアン・カイトシールド",1,"タイガーディフェンダーコート",1,"ドマアイアンアレンビック",1,"タイガー・スカウトトライコーン",1,"タイガー・ヒーラージャックブーツ",1,"タイガー・ギャザラーフィンガレスグローブ",1,"ダリウムアストロメーター",1,"ダリウムディフェンダーヘアピン",1,"スタースピネル・ディフェンダーイヤリング",1,"クズクロス・ストライカートラウザー",1,"クズクロス・クラフターキュロット",1,"クズクロス・ギャザラーコート",1,"ドマアイアンダガー",1,"ドマアイアン・クローハンマー",1,"ドマアイアン・クリナリーナイフ",1,"餅鉄",10,"",1,"",1,"椎茸",10,"葛根",10,"馬芹",10,"サンバス",1,"アカメ",4,"",1
66,"パーシモンボウ",1,"パーシモンケーン",1,"ガゼルホーン・フィッシングロッド",1,"天ぷら盛り合わせ",3,"ステップサラダ",3,"ゼラスープ",3,"グロースフォーミュラ・テータ",1,"",1,"",1,"ドマスチール・スレイヤーガントレット",1,"ドマスチール・ストライカーグリーヴ",1,"ドマスチール・スカウトガントレット",1,"マーリドヒーラーブーツ",1,"マーリドストライカーフード",1,"マーリドキャスターグローブ",1,"アズライトヒーラーブレスレット",1,"アズライトレンジャーリング",1,"ガゼルホーンニードル",1,"サージレンジャーハット",1,"サージヒーラーハット",1,"サージキャスターハット",1,"ドマスチール・バトルアクス",1,"ドマスチール・ラウンドナイフ",1,"プルームド・ドマスチールピック",1,"翠銀砂",10,"",1,"",1,"パーシモンリーフ",10,"大根",10,"フェンネル",10,"弓魚",1,"天狗団扇",4,"",1
67,"スレートグラインディングホイールDX",1,"パーシモンスピニングホイール",1,"パーシモンネックレス",1,"パーシモンプディング",3,"芙蓉蟹",3,"潮汁",3,"マーリドグリモア",1,"マーリドコーデックス",1,"魔匠の薬茶",3,"ドマスチール・ディフェンダータバード",1,"ドマスチール・スレイヤーアーメット",1,"ドマスチール・サボテンダーフライパン",1,"マーリドディフェンダーブリーチ",1,"マーリドギャザラーボレロ",1,"マーリドイヤリング",1,"スタースピネル・キャスターチョーカー",1,"ダリウムロッド",1,"ダリウムフルーレ",1,"サージレンジャーガンビスン",1,"サージキャスターホーズ",1,"サージギャザラーターバン",1,"ドマスチールマスケトン",1,"ドマスチールファイル",1,"ドマスチールモーター",1,"真砂砂鉄",10,"",1,"",1,"パーシモン",10,"パーシモン原木",10,"紅玉昆布",10,"龍魚",1,"ドタールフィッシュ",4,"",1
68,"モリブデントライデント",1,"ゼルコバロングボウ",1,"ゼルコバケーン",1,"ドマ茶",3,"鬼殻焼",3,"ヒラマサの兜煮",3,"ガゼルグリモア",1,"ガゼルコーデックス",1,"",1,"モリブデン・ディフェンダーヘッドギア",1,"モリブデン・スレイヤーヘッドギア",1,"",1,"ガゼル・スレイヤーオープンブーツ",1,"ガゼル・ストライカーオープンブーツ",1,"ガゼルヒーラーブレーサー",1,"モリブデンヒーラーイヤリング",1,"パラースディフェンダーブレスレット",1,"パラース・アタッカーアーマーリング",1,"ツインシルク・ストライカーフード",1,"ツインシルク・スカウトターバン",1,"ツインシルク・ヒーラーフード",1,"モリブデンロングソード",1,"モリブデンダガー",1,"水鉛鋼打刀",1,"翠銀鉱",10,"",1,"",1,"ヤンサセリ",10,"御形",10,"チックウィード",10,"ブルズバイト",1,"ジャイアントコレクター",4,"",1
69,"ゼルコバイヤリング",1,"ゼルコバブレスレット",1,"ゼルコバリング",1,"ちらし寿司",3,"ジャムメルジャーキー",3,"味噌田楽",3,"活力の薬湯",3,"心力の薬湯",3,"",1,"モリブデンカイトシールド",1,"モリブデンディフェンダーグリーヴ",1,"モリブデン・スカウトアームガード",1,"ガゼルディフェンダーコート",1,"ガゼルストライカーブレー",1,"ガゼル・キャスターアームガード",1,"パラースロッド",1,"パラースタック",1,"インペリアルジェード・キャスターアルミラ",1,"ツインシルク・ディフェンダースロップ",1,"ツインシルク・レンジャーローブ",1,"ツインシルク・レンジャースロップ",1,"モリブデンランプハンマー",1,"パラース・ゴールドスミスハンマー",1,"モリブデンハチェット",1,"清金砂",10,"",1,"",1,"ドマ茄子",10,"玉繭",10,"",1,"瞑想魚",1,"アカククリ",4,"",1
70,"ゼルコバフィッシングロッド",1,"アルマンディングラインディングホイール",1,"ゼルコバスピニングホイール",1,"キジハタの清蒸",3,"カワダイの煮込み",3,"ジャムメルムサカ",3,"剛力の薬湯",3,"眼力の薬湯",3,"知力の薬湯",3,"モリブデンアレンビック",1,"モリブデンフライパン",1,"",1,"ガゼルクラフターグローブ",1,"ガゼルシューズ",1,"ガゼルクロスリング",1,"インペリアルジェード・キャスターイヤリング",1,"インペリアルジェード・レンジャーネックレス",1,"インペリアルジェード・ヒーラーネックレス",1,"ツインシルク・クロップドパンツ",1,"サージポンチョ",1,"サージワークグローブ",1,"モリブデンプライヤー",1,"モリブデンモーター",1,"モリブデンモール",1,"輝水鉛鉱",10,"",1,"",1,"ゼルコバ原木",10,"",1,"",1,"ホワイトホース",1,"焔魚",4,"",1
71,"ホワイトオークイヤリング",1,"ホワイトオークブレスレット",1,"ホワイトオークリング",1,"パープルカロットジュース",3,"",1,"",1,"グロースフォーミュラ・イオタ",1,"",1,"",1,"ディープゴールド・ディフェンダーガントレット",1,"ディープゴールド・アレンビック",1,"ディープゴールド・スカウトマスク",1,"スミロドンスレイヤーレギンス",1,"スミロドンスカウトグローブ",1,"スミロドンイヤリング",1,"アイランドウルフ・レンジャーリング",1,"アイランドウルフ・キャスターリング",1,"アイランドウルフ・アタッカーリング",1,"ホワイトヘンプ・クラフターターバン",1,"ホワイトヘンプ・クラフターボトム",1,"ホワイトヘンプ・ギャザラーターバン",1,"ディープゴールド・レイジングハンマー",1,"ディープゴールド・クローハンマー",1,"ディープゴールドファイル",1,"硬泥岩",10,"硬金砂",10,"",1,"ホワイトオークの枝",10,"フラントーヨ",10,"ホワイトオーク原木",10,"アステロイデア",1,"レイクラウス",4,"",1
72,"ミラクルアップルスピア",1,"ミラクルアップル・ロングボウ",1,"",1,"キャラメル",3,"",1,"",1,"極錬精薬",3,"",1,"",1,"ディープゴールド・スレイヤーソルレット",1,"ディープゴールド・スレイヤーガントレット",1,"ディープゴールド・ディフェンダーウィングス",1,"グリーングライダー・ストライカーグローブ",1,"グリーングライダー・レンジャーブーツ",1,"グリーングライダー・スカウトグローブ",1,"ダイアスポアディフェンダーリング",1,"ダイアスポアヒーラーリング",1,"ダイアスポアキャスターリング",1,"イリディセントスレイヤーフード",1,"イリディセントストライカーハット",1,"イリディセントレンジャーハット",1,"ディープゴールドダガー",1,"ディープゴールドソード",1,"硬金打刀",1,"硬金鉱",10,"",1,"",1,"ブラッドトマト",10,"ミラクルアップル原木",10,"ガーデンビート",10,"ミストキリフィッシュ",1,"シャードガジオン",4,"",1
73,"ミラクルアップルケーン",1,"ミラクルアップルスタッフ",1,"",1,"ブロードビーンサラダ",3,"グリルドプラチナブリーム",3,"スパゲッティ・ネーロ",3,"剛力の幻水G1",3,"知力の幻水G1",3,"活力の幻水G1",3,"ディープゴールドシールド",1,"ディープゴールド・ディフェンダーメイル",1,"ディープゴールド・スレイヤーサーコート",1,"グリーングライダー・ディフェンダーサイブーツ",1,"グリーングライダー・スレイヤーブリーチ",1,"グリーングライダー・ヒーラーグローブ",1,"ストーンゴールドオーラリー",1,"ストーンゴールドレイピア",1,"ダイアスポアレンジャーブレスレット",1,"イリディセントレンジャーボトム",1,"イリディセントヒーラーボトム",1,"イリディセントキャスターボトム",1,"ディープゴールドアークウィバス",1,"ディープゴールドバヨネット",1,"ディープゴールドチャクラム",1,"高地天然水",10,"",1,"",1,"虹マユ",10,"アップランド小麦",10,"",1,"ツノカブリ",1,"ミストアイ",4,"",1
74,"ブルースピリットケーン",1,"ホワイトアッシュ・フィッシングロッド",1,"ホワイトアッシュ・スピニングホイール",1,"バゲット",3,"ピクシーアップルパイ",3,"ブラッドトマトジュース",3,"ブルースピリットグリモア",1,"ブルースピリットコーデックス",1,"マナシルバーエンチャントインク",1,"ブルースピリット・スレイヤーガントレット",1,"ブルースピリット・キャスターヘッドギア",1,"ブルースピリット・スレイヤーサバトン",1,"アトロシラプトル・スカウトレッグガード",1,"アトロシラプトル・アタッカーアミュレット",1,"アトロシラプトル・ギャザラーグローブ",1,"ブルースピリットバグナウ",1,"ブルースピリット・スターグローブ",1,"ブルースピリットグレイヴ",1,"ピクシーコットン・ストライカースリーヴ",1,"ピクシーコットン・クラフターハット",1,"ピクシーコットン・ギャザラースロップ",1,"ブルースピリットソード",1,"ブルースピリット・ハンドゴンネ",1,"ブルースピリットモーター",1,"霊青岩",10,"",1,"",1,"ホワイトアッシュ原木",10,"妖綿花",10,"",1,"ゲコクジョウ",1,"デイジーターバン",4,"",1
75,"ホワイトアッシュ・ディフェンダーイヤリング",1,"ホワイトアッシュネックレス",1,"ホワイトアッシュリング",1,"ナッツペストリー",3,"ブラッドトマトサラダ",3,"マッシュルームソテー",3,"植物性にかわ",1,"名匠の水薬",3,"",1,"ブルースピリット・タワーシールド",1,"ブルースピリット・ディフェンダーキュイラス",1,"ブルースピリット・ポークシーフライパン",1,"アトロシラプトル・レンジャーコースリット",1,"アトロシラプトル・ディフェンダーアミュレット",1,"アトロシラプトル・ディフェンダーブリーチ",1,"マナシルバーニードル",1,"マナシルバー・イヤーカフ",1,"ラズライトディフェンダーリング",1,"ピクシーコットン・スカウトブレー",1,"ピクシーコットン・ヒーラーローブ",1,"ピクシーコットン・ストライカーアクトン",1,"ブルースピリット・レイジングハンマー",1,"ブルースピリットピック",1,"ブルースピリット・ラウンドナイフ",1,"魔銀砂",10,"",1,"",1,"オオミツバチの巣",10,"クリームマッシュルーム",10,"ロイヤルグレープ",10,"スポテッドクテノポマ",1,"ペタルフィッシュ",4,"",1
76,"サンドチークフォチャード",1,"サンドチーク・ロングボウ",1,"サンドチークケーン",1,"ローストオヴィム",3,"マッシュルームスキュアー",3,"ベイクド・メガピラニア",3,"グロースフォーミュラ・カッパ",1,"強重曹",1,"",1,"チタンブロンズ・スカウトヘッドバンド",1,"",1,"",1,"ゾヌールストライカーカリガ",1,"ゾヌール・ヒーラーフィンガレスグローブ",1,"ゾヌール・キャスターフィンガレスグローブ",1,"トリプライトヒーラーイヤリング",1,"チタンブロンズ・スターグローブ",1,"チタンブロンズレイピア",1,"オヴィムレンジャーボトム",1,"オヴィムヒーラースカート",1,"オヴィムキャスターチュニック",1,"チタンブロンズキリジ",1,"賢銅打刀",1,"チタンブロンズバヨネット",1,"賢銅砂",10,"",1,"",1,"アンバークローヴ",10,"サンドチーク原木",10,"スイートアリッサム",10,"クラウンテトラ",1,"ダンディーフィッシュ",4,"ハンターズアロー",4
77,"サンドチーク・フィッシングロッド",1,"サンドチーク・グラインディングホイール",1,"サンドチーク・スピニングホイール",1,"ラセットポポトグラタン",3,"ペッパーポポト",3,"マサラチャイ",3,"ゾヌールグリモア",1,"ゾヌールコーデックス",1,"魔匠の水薬",3,"チタンブロンズアレンビック",1,"チタンブロンズ・モーグリフライパン",1,"チタンブロンズ・タワーシールド",1,"ゾヌールディフェンダーコート",1,"ゾヌール・スレイヤーフィンガレスグローブ",1,"ゾヌールギャザラーグローブ",1,"チタンブロンズ・スレイヤーヘッドギア",1,"トリプライトキャスターチョーカー",1,"チタンブロンズニードル",1,"オヴィムクラフターターバン",1,"オヴィムクラフターガスキン",1,"オヴィムスレイヤーボトム",1,"チタンブロンズモール",1,"チタンブロンズファイル",1,"チタンブロンズ・レザーワーカーナイフ",1,"賢銅鉱",10,"",1,"",1,"ピナータラベンダー",10,"",1,"",1,"シルバーキティ",1,"フラワリングケルピー",4,"スプークフィッシュ",4
78,"リグナムバイタ・ドワーヴンランス",1,"リグナムバイタ・ドワーヴンボウ",1,"リグナムバイタ・ドワーヴンポール",1,"エスプレッソ・コン・パンナ",3,"ミストスピナッチソテー",3,"リゾット・ネーロ",3,"ハイミスリル・ドワーヴングリモア",1,"ハイミスリル・ドワーヴンコーデックス",1,"ダークミスリルエンチャントインク",1,"ハイミスリル・ディフェンダーシューズ",1,"ハイミスリル・スレイヤーチェーンメイル",1,"ハイミスリル・ストライカーヘルム",1,"シースワロー・スレイヤーグローブ",1,"シースワロー・レンジャーローブ",1,"シースワロー・ストライカーシューズ",1,"ハイミスリル・ドワーヴンレイピア",1,"ペタライトアタッカーイヤリング",1,"ペタライトレンジャーリング",1,"ドワーフコットン・スレイヤーガスキン",1,"ドワーフコットン・ヒーラーガスキン",1,"ドワーフコットン・キャスターペタソス",1,"ハイミスリル・ドワーヴンロータリー",1,"ハイミスリル・ドワーヴンスフィア",1,"ハイミスリル・ドワーヴングレイヴ",1,"地下天然水",10,"",1,"",1,"ハーコット",10,"ライムバジル",10,"コーヒービーン",10,"デザートソー",1,"ジェスターフィッシュ",4,"ブルーライトニング",4
79,"リグナムバイタネックレス",1,"リグナムバイタブレスレット",1,"リグナムバイタリング",1,"ブラッドブイヤベース",3,"パエリア",3,"コーヒークッキー",3,"活力の幻薬",3,"心力の幻薬",3,"",1,"ハイミスリル・ドワーヴンシールド",1,"",1,"",1,"シースワロー・ヒーラーグローブ",1,"シースワロー・キャスターシューズ",1,"シースワロー・ヒーラーローブ",1,"ペタライトディフェンダーチョーカー",1,"ペタライトヒーラーブレスレット",1,"ペタライトキャスターブレスレット",1,"ドワーフコットン・レンジャーターバン",1,"ドワーフコットン・スカウトガスキン",1,"ドワーフコットン・レンジャーガスキン",1,"ハイミスリル・クローハンマー",1,"ハイミスリルプライヤー",1,"ハイミスリル・クリナリーナイフ",1,"闇霊銀砂",10,"",1,"",1,"タイガーリリー",10,"ライトガーベラ",10,"ドワーフ綿花",10,"暗紫珊瑚",1,"ハーミットクラブ",4,"",1
80,"リグナムバイタ・フィッシングロッド",1,"リグナムバイタ・グラインディングホイール",1,"リグナムバイタ・スピニングホイール",1,"レモネード",3,"ハーコットゼリー",3,"ローエディブルオイスター",3,"剛力の幻薬",3,"眼力の幻薬",3,"知力の幻薬",3,"ハイミスリルアレンビック",1,"ハイミスリルフライパン",1,"",1,"シースワロー・フィンガレスグローブ",1,"シースワローシューズ",1,"シースワローコート",1,"ハイミスリルニードル",1,"ハイミスリル・イヤーカフ",1,"ハイミスリルブレスレット",1,"ドワーフコットンベレー",1,"ドワーフコットンジャケット",1,"ドワーフコットントラウザー",1,"ハイミスリル・ラピダリーハンマー",1,"ハイミスリル・ラウンドナイフ",1,"ハイミスリルピック",1,"闇霊銀鉱",10,"",1,"",1,"リグナムバイタ原木",10,"",1,"",1,"フードウィンカー",1,"ダイヤモンドアロワナ",4,"アンパの使者",4
81,"ホースチェスナットケーン",1,"ホースチェスナット・フィッシングロッド",1,"栃乃木笠",1,"ジュレック",3,"",1,"",1,"ガジャグリモア",1,"ガジャコーデックス",1,"ハイダリウム・エンチャントインク",1,"ハイダリウムシールド",1,"ハイダリウム・レンジャーアームガード",1,"ハイダリウム・アレンビック",1,"ガジャ・ストライカーベスト",1,"ガジャ・スカウトシューズ",1,"ガジャ・キャスターサークレット",1,"ハイダリウムプラニスフィア",1,"ハイダリウム・ストライカーバイザー",1,"アメトリン・ヒーラーブレスレット",1,"ダークヘンプ・スカウトスカート",1,"ダークヘンプ・キャスターフィンガレスグローブ",1,"黒麻胴着",1,"ハイダリウムソード",1,"ハイダリウム・クロスペインハンマー",1,"ハイダリウム・ピック",1,"アメトリン原石",20,"輝翠銀砂",20,"",1,"ホースチェスナット原木",20,"黒麻",20,"",1,"キクラ・ピニマ",2,"オニヒゲ",5,"",1
82,"パームハルバード",1,"パームロングボウ",1,"パーム・レンジャーイヤーカフ",1,"アームラサラダ",3,"アームララッシー",3,"ミコッテ風島の幸串焼",3,"マウンテンチキングリモア",1,"マウンテンチキンコーデックス",1,"",1,"ハイダリウム・ディフェンダーソルレット",1,"ハイダリウム・スレイヤーガントレット",1,"ハイダリウム・スレイヤーソルレット",1,"マウンテンチキン・ストライカーグローブ",1,"マウンテンチキン・レンジャーサイブーツ",1,"マウンテンチキン・ヒーラーサイブーツ",1,"ピューターロッド",1,"ピューター・スレイヤーサークレット",1,"ピューター・キャスターリング",1,"アルマスティ・ストライカーヘッドバンド",1,"アルマスティ・スカウトヘッドバンド",1,"アルマスティ・ヒーラーハット",1,"ハイダリウムブージ",1,"輝翠銀打刀",1,"ハイダリウムグレイブ",1,"輝翠銀鉱",20,"白目鉱",20,"",1,"パームシロップ",20,"サベネアンパプリカ",20,"",1,"メソナウタ",2,"トラザメ",5,"",1
83,"パーム・ディフェンダーブレスレット",1,"パーム・アタッカーブレスレット",1,"パーム・キャスターブレスレット",1,"キングクラブケーキ",3,"ウハー",3,"ボルシチ",3,"剛力の幻水G5",3,"活力の幻水G5",3,"心力の幻水G5",3,"ハイダリウムカイトシールド",1,"ハイダリウム・ディフェンダーアーマー",1,"ハイダリウム・スレイヤーアーマー",1,"マウンテンチキン・ディフェンダーホーズ",1,"マウンテンチキン・ストライカージャケット",1,"マウンテンチキン・スカウトホーズ",1,"ピューター・ディフェンダーチョーカー",1,"ピューター・レンジャーチョーカー",1,"ピューター・ヒーラーチョーカー",1,"アルマスティ・レンジャーコート",1,"アルマスティ・ヒーラーグローブ",1,"アルマスティ・キャスターコート",1,"ハイダリウムセスタス",1,"ハイダリウムマスケトン",1,"ハイダリウムウォーサイズ",1,"フリギアンゴールド鉱",20,"",1,"",1,"キューカンバー",20,"エブラーナレンティル",20,"",1,"婚宴の絹",2,"ウメイロ",5,"",1
84,"レッドパインスピア",1,"レッドパインケーン",1,"",1,"ビーツスープ",3,"エンペラースープ",3,"",1,"サイガグリモア",1,"サイガコーデックス",1,"",1,"ビスマス・ヒーラーブレスレット",1,"ビスマス・キャスターブレスレット",1,"ビスマス・レンジャーリング",1,"サイガ・ディフェンダーアームガード",1,"サイガ・レンジャーグローブ",1,"サイガ・ヒーラーシューズ",1,"フリギアンハンガー",1,"フリギアンウィング",1,"フリギアン・ヒーラーチョーカー",1,"スノーリネン・スカウトキャップ",1,"スノーリネン・ヒーラーキャップ",1,"スノーリネン・キャスターサルエル",1,"ビスマスボウ",1,"ビスマスグレートソード",1,"ビスマスガンブレード",1,"エブラーナアルメン",20,"",1,"",1,"雪亜麻",20,"ビーツ",20,"",1,"フラワーホーン",2,"冠魚",5,"ホテイウオ",5
85,"レッドパイン・フィッシングロッド",1,"レッドパイン・グラインディングホイール",1,"レッドパイン・スピニングホイール",1,"ハピネスジュース",3,"キャロットラペ",3,"",1,"名匠の薬酒",3,"ムーンゲル",1,"黄色火薬",1,"ビスマス・ディフェンダーゴーグル",1,"ビスマス・スレイヤーヘッドギア",1,"ビスマス・ファットキャットフライパン",1,"サイガ・スレイヤーコート",1,"サイガ・クラフターグローブ",1,"サイガ・ギャザラーサンダル",1,"フリギアン・ディフェンダーイヤーカフ",1,"フリギアン・レンジャーイヤーカフ",1,"フリギアン・ニードル",1,"スノーリネン・クラフターボトム",1,"スノーリネン・ギャザラーターバン",1,"スノーリネン・ギャザラーコート",1,"ビスマス・ソー",1,"ビスマス・ラピダリーハンマー",1,"ビスマス・クリナリーナイフ",1,"蒼鉛鉱",20,"",1,"",1,"ハピネスキャロット",20,"",1,"",1,"インペリアルプレコ",2,"ヨシキリザメ",5,"ウチワフグ",5
