key,0,1,2,3,4,5,6,7,8,9,10,11
#,,BNpcBase[0],BNpcBase[1],,,Icon[0],Icon[1],Icon[2],Icon[3],Icon[4],,
int32,uint16,BNpcName,BNpcName,byte,bit&01,Image,Image,Image,Image,Image,str,str
0,50,"猎隼驱逐者","渡鸦驱逐者",6,False,"ui/icon/060000/060666.tex","ui/icon/061000/061651.tex","ui/icon/061000/061654.tex","ui/icon/060000/060939.tex","ui/icon/060000/060942.tex","巡航驱逐者","应用反重力机关悬浮前进的最新型次世代机动兵器。
它的回旋碎踢可以击碎机动兵器的装甲,
还装备着对步兵专用的剑与鹰式破坏炮。
轻量型高机动力，与之相对，耐久力则较低。
且因为重视产量而没有采用变形结构。"
1,50,"猎隼压迫者","渡鸦压迫者",2,False,"ui/icon/060000/060667.tex","ui/icon/061000/061652.tex","ui/icon/061000/061655.tex","ui/icon/060000/060940.tex","ui/icon/060000/060943.tex","压迫者","以攻略要塞为目标而开发出的重型机动兵器。
擅长破坏敌方的防御塔与核心。
能够量产压迫者的话，敌方的核心也就不堪一击了。
但是，因为是笨重的重型装甲，
所以不擅长对付步兵与别的机动兵器。"
2,50,"猎隼正义号","渡鸦正义号",2,True,"ui/icon/060000/060668.tex","ui/icon/061000/061653.tex","ui/icon/061000/061656.tex","ui/icon/060000/060941.tex","ui/icon/060000/060944.tex","残暴正义号","以压倒性的力量蹂躏战场的最终机动兵器。
使用大火炎放射与巨型光束炮扫清敌人，
并以双重火箭飞拳粉碎敌方防御塔与核心。
顺便一提,为了节省生产成本而没有使用分离合体结构，
这也是量产机的局限性吧。"
