key,0,1,2,3,4,5
#,,,Name,Text,,
int32,byte,byte,SnipeTalkName,str,str,str
0,0,0,"","","",""
1,0,0,"","","",""
2,0,0,"","","",""
3,0,0,"","","",""
4,0,0,"","","",""
5,0,0,"","","",""
6,0,0,"","","",""
7,0,0,"","","",""
8,0,0,"","","",""
9,0,0,"","","",""
10,61,1,"ローンロン","……どうしたネ？
ローンロンを買うなら、フッブート金貨1枚じゃ足りないヨ？","",""
11,61,1,"サンクレッド","さて、水晶公は何と言っていたか……。","",""
12,61,1,"ミンフィリア","ちょっと、暗いですね……。
上で蝋燭をわけてもらった方がいいでしょうか……？","",""
13,61,1,"ヤ・シュトラ","…………？
私をじっと見て、どうしたというの？
こちらの調査は、もう少しかかるわよ。","",""
14,61,1,"水晶公","イテッ……！？
ど、どうして私を狙うんだ……！","",""
15,57,7,"","撃たれても微動だにせず、じっとこちらを見つめている。
少なくとも、ドワーフ族ではなさそうだ……。","",""
16,61,1,"のこのこドワーフ","わお、大正解～！
その識別力と行動力に、拍手ラリ～！","",""
17,61,1,"のこのこドワーフ","はっずれー！
ボクは正真正銘、トルーの兜を被ってまーす！
やーいやーい！　ンー、やーい！","",""
18,61,1,"のこのこドワーフ","ンガッハハハ！　フフ！　グフフ！
俺は撃っちゃいけないやつだぞ、まだまだだな！","",""
19,57,7,"","それらしき人物を発見した！","",""
20,57,7,"","……堂々とした佇まいだ。
しかし、ミステル族ではない。","",""
21,57,7,"","とても古そうな壁画だ。
中央の人物が武器を掲げている。
黒い獣が倒され、周りの人々は喜んでいるようだ……。","",""
22,57,7,"","かなり古そうな壁画だ。
玉座に座った人物に、大勢の人が謁見している……。","",""
23,57,7,"","それなりに古そうな壁画だ。
渦巻く闇と対峙する、数名の人物が描かれているようだが、
中央が無残に削り取られている……。","",""
24,61,1,"ローンロン","それは「ダラダラよだれパン」ネ！
中に、甘酸っぱいサボテンの実がたくさん練りこんであるから、
パサパサしてても大丈夫！　健康にもいいヨ！","",""
25,61,1,"ローンロン","それは「メラメラやる気ハム」ネ！
リザードの貴重な部位を、秘伝のスパイスでハムにしたヨ！
ちょっと変な匂いがするけど、食べると体がカッカするネ！","",""
26,61,1,"ローンロン","それは「モチモチおやつ串」ネ！
近くの岩場に隠れている小型のカエルを、シンプルに焼いたヨ！
あっさりしていて、食べやすいネ！","",""
27,61,1,"ローンロン","それは「ぷりぷりミミズ漬け」ネ！
みんな大好き白ミミズを、蜜に漬けこんだ夢の一品ヨ！
これ以外のスイーツは食べられなくなるネ！","",""
28,57,7,"","古びた石板を発見した！","",""
29,61,1,"ウリエンジェ","ふむ……これが祭壇だと思われますが、
「夜の民」の代表的な祭具である、水鏡がありませんね。
移動するときに、それだけ持ち去ったのでしょうか……。","",""
30,57,7,"","それらしき人物を発見した！
しかし、集落の方へと逃げていってしまった……。","",""
31,57,7,"","じ～っと、こちらを見つめている。
正体不明の人影ではないようだ……。","",""
32,61,1,"のこのこドワーフ","ラリホー！　お見事！
その調子で、本番もがんばれー！","",""
33,57,7,"","高くそびえた細長い建物に、多くの窓がついている。
ほかでは見かけない、特徴的な形と言えるだろう。","",""
34,57,7,"","……なぜか、ハシビロコウがいる。
理由はちっともわからないが、堂々と、いる。","",""
35,57,7,"","クリオニッドの幼生が、気弱そうな表情で漂っている……。
きっと、おとなしい生き物に違いない。","",""
36,61,1,"水晶公","ッ！？　どさくさに紛れて狙わないでくれ！
外れない、フードは外れないから……っ！","",""
37,57,7,"","撃たれても微動だにせず、
じっと、じ～～～っとこちらを見つめている。
どうあれ、ドワーフ族ではなさそうだ……。","",""
38,0,0,"","","",""
39,61,1,"あたふたレポリット","うきゅっ！？
いったい何ですかぁ……！
お仕事の邪魔は、ご遠慮ください！","",""
40,61,1,"シンギングウェイ","うーん……ここからじゃ見えづらいが、
タンクの上に、金色の管が通ってるよな？","で、少し下の窓から覗き見ると……
タンクの下部が、また大きな管に繋がってるみたいだ。","となると、汲み上げた水をろ過して不純物を取り除く、
「浄水装置」ってところかな。"
41,61,1,"シンギングウェイ","巨大な筒が、壁の向こうに突き刺さってる……
壁のあっち側は、音からして水源か？","そして、筒の先端から飛び出した軸が、伝動部を介して、
回転する車輪状の動力装置と繋がっている……。","ってことは、水を汲み上げる「揚水装置」だな！
筒の中に螺旋状のスクリューが入ってるはずだぞ。"
42,61,1,"シンギングウェイ","おっ、これはグレーテスト・エンズヴィルにあるぞ。
ズバリ、「大きな樹」だな！？","……違う？　そっかぁ。
上部の容積が極端に大きくて、そこから下は細い……
何より、かなりの高さがある……。","そうか、上部に汲み上げた水を、
水圧を使って送り出す、「給水塔」かもしれないな！"
43,57,7,"","アンビストマ……！
活きのいいアンビストマがいる……！","あのあと、無事にイデアが登録され、
世界に息づく生物のひとつになったのだろう。
壮大な歴史を感じる……。",""
44,61,1,"ランニングウェイ？","ほぐぁーーーっ！？
オレっちにムースボールを当てるとは……
おめータダモンじゃねーな……！？","",""
45,57,7,"","間違った鳥に、麻酔針を当ててしまったようだ……。","",""
46,61,1,"サリャク像を眺める男性","この像は、エオルゼア十二神の一柱にして、
シャーレアンの守護神でもある「サリャク」を象ったもの。
河川と知識を司るとされる男神ですな。","かつて我が国では、全住民が参加する「市民議会」で、
政策を決定するという直接民主主義を採用しておりましてな。
守護神もまた、住民投票によって決定されたのです。","しかし、サリャク神を選んだ理由は、
信仰心というより、むしろ思想信条に近いものでした。
「知識の集積者たれ」との使命感を抱く国民性ゆえでしょうな。"
47,61,1,"サリャク像を眺める男性","神話によれば、サリャク神は、
知識の水が湧き出す「水瓶」を携えていたといいます。","この石像の水瓶は、その逸話を再現したもの。
水路から引いた水を、途切れることなく海に注ぎ続ける。
シャーレアンが知識湧く街であるよう願いを込めたわけですな。","この機構を実現するためには、大変な苦労があったのだとか。
魔法大学が誇るヌーメノン大書院には、
当時の石工たちが遺した奮闘記なども収蔵されておりますぞ。"
48,61,1,"サリャク像を眺める男性","エオルゼアを大洪水が襲った第六霊災。
後に十二賢者と呼ばれる者たちが危機に抗い、
多くの人々を救ったと伝えられております。","我らがシャーレアンは、
その十二賢者のひとりである「ニュンクレフ」が、
自らが助け出した洪水被災者たちとともに造り上げた国。","その最初の住人たちが上陸したのが、
まさにご覧になっておられる石像の裾の浜辺……。
今から1600年近くも昔の出来事ですな。"
49,0,0,"","","",""
50,0,0,"","","",""
51,57,7,"","オミクロンが佇んでいる。
直立不動の様は、いかにも待機中だ。","",""
52,57,7,"","オミクロンが、装置の近くに控えている。
これといった行動をとることもなく、待機中のようだ。","",""
53,57,7,"","オミクロンが、アルフィノと話している。
楽しい会話になっているかどうかは不明だが、
異常はなさそうだ。","",""
54,57,7,"","オミクロンではない、アンビストマだ！
驚くほど宇宙が似合っている……！","ラヴィリンソスで飼育されていた個体が、
魔導船に潜り込んでいたのだろうか？
なんて活きがいいのだろう……。",""
55,57,7,"","オミクロンが、ひたすらに徘徊している。
でたらめな動きは、目的を持っているようには見えない……。","",""
56,0,0,"","","",""
