key,0,1
#,,
int32,str,str
0,"TEXT_CTSOPN60NEMJIJI_00732_CFC_TO_INSTANCE_CONTENT","<Sheet(ContentFinderCondition,IntegerParameter(1),3)/>"
1,"TEXT_CTSOPN60NEMJIJI_00732_NEMJIJI_000_000","調査へのご協力、誠にありがとうございます。
それにしても、報告にあった過去の創造生物……
その生態を考え始めると……ふふふ、推論が捗りますわ……！"
2,"TEXT_CTSOPN60NEMJIJI_00732_Q1_000_000","何をする？"
3,"TEXT_CTSOPN60NEMJIJI_00732_A1_000_003","調査状況の確認"
4,"TEXT_CTSOPN60NEMJIJI_00732_A1_000_004","キャンセル"
5,"TEXT_CTSOPN60NEMJIJI_00732_NEMJIJI_000_100","<Split(<Highlight>ObjectParameter(1)</Highlight>, ,1)/>様、少しよろしいでしょうか。
ご報告いただいた過去の世界での出来事について、
もう少し、詳しい話をお聞かせ願いたいのです。"
6,"TEXT_CTSOPN60NEMJIJI_00732_NEMJIJI_000_101","クリスタルが発した警告の意味、パンデモニウムの結末。
そういった今回の事件に関する事象はすべて、
いずれクローディエン先生が学会へと報告なさるでしょう。"
7,"TEXT_CTSOPN60NEMJIJI_00732_NEMJIJI_000_102","そのときのため、より仔細な記録を残しておきたいのです。
具体的には……そう、「辺獄」で貴方が対面した、
脅威的存在たちについて、もっともっと……！"
8,"TEXT_CTSOPN60NEMJIJI_00732_RUISSENAUD_000_103","ネムジジさん！　頼まれた資料を揃えましたが、
あれ、本当に全部クリスタルの謎を解明するのに必要なんですか？"
9,"TEXT_CTSOPN60NEMJIJI_00732_RUISSENAUD_000_104","『水棲生物の生態』や、『各地に残るフェニックス伝承』など。
パンデモニウムの創造生物に関連したような、
論文も含まれてましたけど。"
10,"TEXT_CTSOPN60NEMJIJI_00732_RUISSENAUD_000_105","創造生物は、<Split(<Highlight>ObjectParameter(1)</Highlight>, ,1)/>さんが倒して、
再封印したんだから、そこまで調べなくてもいいんじゃ……。"
11,"TEXT_CTSOPN60NEMJIJI_00732_NEMJIJI_000_106","そんなことはありません。
はるか古の時代、この世界に存在した創造生物を、
現代の研究者視点で調査することには大変な意義があります。"
12,"TEXT_CTSOPN60NEMJIJI_00732_NEMJIJI_000_107","……私としても、とっても気になりますし。"
13,"TEXT_CTSOPN60NEMJIJI_00732_RUISSENAUD_000_108","やっぱり、個人的興味じゃないですか……。
まったくの無関係ではないので、論文も揃えましたけど、
今度から資料集めは、自分でお願いしますよ？"
14,"TEXT_CTSOPN60NEMJIJI_00732_NEMJIJI_000_110","……さあ、話をもとに戻しましょう。
脅威的存在との戦いについて、教えてくださいますか？"
15,"TEXT_CTSOPN60NEMJIJI_00732_NEMJIJI_000_111","あ、エリクトニオスさんが魔法により変化した異形の姿や、
「ヘーミテオス」と化した獄卒長のお話もお願いします。
どちらも面白そ……いえ、興味深い事象ですから。"
16,"TEXT_CTSOPN60NEMJIJI_00732_NEMJIJI_000_112","ふむふむ、貴重なお話をありがとうございました。
実際の存在をこの目で見られないのは残念ですが、
なるべく詳細な記録を作れるよう、励みたいと思います。"
17,"TEXT_CTSOPN60NEMJIJI_00732_NEMJIJI_000_113","そうですわ……。
創造生物の生態について、簡単な推論も添えて、
一緒に記録に残しておくと参考になるかもしれませんね。"
18,"TEXT_CTSOPN60NEMJIJI_00732_NEMJIJI_000_114","たとえば……現代の水棲生物の中には、
成長後は、幼生期の数十倍になる生物がいます！"
19,"TEXT_CTSOPN60NEMJIJI_00732_NEMJIJI_000_115","もしかしたら、<Split(<Highlight>ObjectParameter(1)</Highlight>, ,1)/>様が遭遇した、
「ヒッポカムポス」もまだ幼体で、数十倍の大きさに……！"
20,"TEXT_CTSOPN60NEMJIJI_00732_NEMJIJI_000_116","あら、そんなに驚かれるとは……。
創造生物は成長するのか、という別の疑問もありますし、
これは、いささか飛躍しすぎた推論でしたね。"
21,"TEXT_CTSOPN60NEMJIJI_00732_NEMJIJI_000_117","しかし、想像力とは無限大であるとも思うのです。
実証されるまで、すべての推論には可能性がある……。
ああ、とめどなくインスピレーションが湧いてきました……！"
22,"TEXT_CTSOPN60NEMJIJI_00732_Q1_100_100","何と言う？"
23,"TEXT_CTSOPN60NEMJIJI_00732_A1_100_100","妄想まじりの記録は駄目なのでは……？"
24,"TEXT_CTSOPN60NEMJIJI_00732_A2_100_100","それは、面白そう"
25,"TEXT_CTSOPN60NEMJIJI_00732_NEMJIJI_000_120","ふふふ、推論が書かれた部分には、
「検証中」とでも注釈を入れておけばいいのです！
さあ、<Split(<Highlight>ObjectParameter(1)</Highlight>, ,1)/>様も広げましょう、想像の翼を！"
26,"TEXT_CTSOPN60NEMJIJI_00732_NEMJIJI_000_400","現在は、クローディエン先生の判断で、
各研究機関への報告は最低限の共有に留めております。"
27,"TEXT_CTSOPN60NEMJIJI_00732_NEMJIJI_000_401","詳細な報告をしようにも、パンデモニウムでの事件が、
現代にどの程度影響しているのか、まだ分かっていませんから。"
28,"TEXT_CTSOPN60NEMJIJI_00732_NEMJIJI_000_402","両者を繋ぐのは、クリスタルに封じられている記憶ですが……。
残念ながら、貴方が感じ取ったような思念の類は、
あれから一切、発しておりません。"
29,"TEXT_CTSOPN60NEMJIJI_00732_NEMJIJI_000_403","ソウルクリスタルなど、記憶が刻み込まれた結晶をかき集め、
比較も行っていますが、今のところ成果なし……。"
30,"TEXT_CTSOPN60NEMJIJI_00732_NEMJIJI_000_404","<Split(<Highlight>ObjectParameter(1)</Highlight>, ,1)/>様が聞いた、記憶の警告。
それを私たちも感知できれば、調査の幅も広がるのですが……。
クローディエン先生も、悔しそうにしてらっしゃいましたよ。"
