key,0,1
#,,
int32,str,str
0,"TEXT_REGNOR4UNUKALHAI_00700_UNUKALHAI_000_010","ベーク＝ラグさんの解析結果を待つ間は、
賞金稼ぎの皆さんと修行に明け暮れる毎日ですよ。"
1,"TEXT_REGNOR4UNUKALHAI_00700_UNUKALHAI_000_020","第十三世界に行ってきた、ですって！？
僕たちは、まだかすかな繋がりを維持するのがやっとなのに、
さすがですね……。"
2,"TEXT_REGNOR4UNUKALHAI_00700_UNUKALHAI_000_021","それから、あのヤ・シュトラ殿が次元跳躍の研究を……
アトモスを人工的に造るという着眼点も興味深い。"
3,"TEXT_REGNOR4UNUKALHAI_00700_UNUKALHAI_000_022","今すぐにでも、原初世界に戻って、
貴方の旅に同行したいところですが、今は我慢します。
もう、こちらに「仲間」がいますからね。"
4,"TEXT_REGNOR4UNUKALHAI_00700_UNUKALHAI_000_023","それに、第一世界でなければできないことがあるんです。
貴方もよく知っている最初の罪喰い、エデンのことですよ。"
5,"TEXT_REGNOR4UNUKALHAI_00700_UNUKALHAI_000_024","属性を励起させることで「無の大地」を再生に導いた……
その手法を、第十三世界の再生に、応用できないかと思いましてね。
今度、当事者の方々から詳しく話を聞く約束をしているんです。"
